id_code,start_time,end_time,duration,level,garlic,accuse,bike,bite,bleach,blow,cans,cough,country,crack,dance,dinner,earth,floor,fly,fog,fold,freedom,fruit,good,hammer,hate,hear,hotel,immature,itch,journey,later,law,learn,leaves,liar,look,make,mold,motion,movement,necklace,octopus,old,party,patience,personality,plane,poker,pot,present,rare,referee,refrigerator,rent,shake,slide,spread,state,station,tell,thing,virgin,volcano,write66493,11/19/10 8:51,11/19/10 9:20,29,"something higher, new, different.","strong smell, white, consists of little parts, breaks down easily, bad breath, tasty in food","evidence, trial, court room, action","active, hike, nature, equilibrium","mosquito, dog, marks, painful, scratches","clothes, stains, washer, helper","wind, cold, candles, birthday cake, action","diet coke, active social, recycle","flu, symptom, germy","Romania, not a country girl","egg, joke, broken, needs fixing","party, friends, action, burns calories, fun","delicious, expensive, take out, frozen meals, pasta","astronomy, layers, home, green and blue, continents","cold, white, ground","kill, flies, hard to reach, sound, annoying, plane, high","hard to see, misty, can't drive, not pleasant","clothes, dryer, laundry, towels, clean room","college, away, whatever, whenever, by yourself, break","healthy, love it, grapes","misleading, impression, bad is the new good","nails, picture frames, hanging stuff up, hurts, heavy","strong, misused","noise, sound, pay attention, sense","Austin TX, losing a plane, big rooms, song, tall building, swimming pool, expensive","highschool drama, little girls, young, needs time","mosquito bite, red, uncomfortable, scratching","to the center of the earth, movie, destination, excitement","distant, further away, boy, not a fan","pre-law, school, break the law, fines","school, university, life, school of life, action","fall, colorful, red, yellow, mushy, ground, wetness","boys, frustrasting, annoying, don't  like it, not necessary","good looks, action","craft, art, creative, imagination","gross, smells bad, green","muscles, movement, doing something, physics","can't sleep, everywhere","name, around neck, occasion, long","sea, vicious, fatal, big, taste good, purple","grandparents, fear, death, community service, nursing home, love","fun, friends, drinks, someone's house, dance a lot, songs, pictures","required, great characteristic to have","warm, people, strong willed, key characteristic","Romania, flying, high, white, big, expensive, has little windows, claustrophobic","poker face, song, game, money gained, money lost, Las Vegas","boiling, food, pasta, water","right now, make it or break it",unique,"soccer, game, not loved, Halloween, whistle, black and white, stripes","food, cold beer, minifridge, magnets","way too high, hard to pay, my roommate, coming up on me","handshake, chocolate shake, calories, friendly, good tasting, money","mudslide, winter, snow, hurts, sisters","butter, all over the place, spill, garlic spread","Missouri, state of mind, visit","train, bus, bearline, wait, stop, car","gossip, talk for nothing, he said she said","overused, vague, replacement","boy, movie, someone young","eruption, lava, hot, massive, island, Italy","novel, english class, action, journal"66385,11/19/10 11:16,11/19/10 11:41,25,"uses a bubble to measure, stick, tool","white, strong odor, used in cooking","point fingers, suspect, court room, criminal act","has wheels, transportation, handle bars, seat, pedles","chomp down, child, painful, used to eat","liquid, strong odor, toxic, white, used with laundry","breathe, air, push, pressure, lips","found in the kitchen, hold food, perserves, metal, round top","sick, cold, throat, cover mouth, loud","50 in the US, United States, president of each, many around the world","in the sidewalk, jagged, split, broken","energy, movement, music, romantic, moves","meal at night, family gathering, food","rotates, where we live, in orbit, spherical","hard, cold, wood, cement, ground, rug, what you walk on","bug, big eyes, wings, flys, die,flyswatter","thick, hard to see through, dangerous, low cloud","crease, paper, clothes","privlage, flag, right of United States, allowed to do as one wishes","fresh, apple, grows, gets bad fast, like a vegetable","wanted, not bad, brings happiness","hard, tool, wood, metal, haldle, pounds things, used with nails","dislike, dont want, mean, brings bad feelings","listen, communication, don't talk, noise, sounds","place to sleep, serves breakfast, lots of rooms, maids","not grown up, little kid, teenager, unpolite","irritating, scratch, unwanted, bug bite","adventure, go somewhere, discover new things","not now, afterwords, put off, procrastinate","rules, lawyer, do not break, enforced","teach, school, teacher, knowledge","on trees, yellow, green, brown, fall, different shapes","not truthful, dislike, sneaky","see something, sight, take notice, characteristics","put things together, project","growth, old, nasty, green, unhealthy","movement, creates energy, transportation","motion, back and forth, transportation, creates energy","jewelry, worn around neck, silver or gold, thin, light","8 legs, large head, lives in ocean","not new, wrikley, smelly, unwanted, slow","loud, lots of people, fun, food, music, entertainment","waiting, calm, take turns, stand in line","traits, everyone has one, inner person, how one acts","flys through the air, large, holds lots of people, transportation","card game, money, chips, played around a table, gamble","holds food, used for cooking, found in the kitchen, goes on the stove","gift, Christmas, given to someone, brings joy","not common, special, search for","enforce rules of sports, wears black and white, whistles","keeps things cold, freezer on top, food inside, door, white","borrow, temporary, pay money, not yours, need","a drink, ice cream, liquid, colorful, treat","playground, go down, ladder up, child activity","on bread, whipe, put something on another thing","collection of cities, different laws, mayor","gas, train, to meet, come together, collect materials","talk, inform someone, share, communicate","many different objects, materials, colors,",pure,"errupts, mountain, crater at top, lava","words, class, paper, pencil, pen, information, used to remember"66511,11/21/10 18:18,11/21/10 19:01,43,"The word ""level"" can be used in video games. It can also be used by architects when building homes. Also used to interpret one's reading capacity or academic placement. Level can mean a flat surface.","Garlic can be used for medicine and food. It can often make one's breath smell after consuming it. Garlic is used in the myth of vampires, garlic is said to repel them. It is used as a medicine to prevent heart disease. It has a distinct smell.","assume, blame","two wheels (sometimes four for toddlers), two handlebars, can often have a radio or horn on them, used for transportation","what one does with their teeth when they eat, what a fish does to a fishing pole,","laundry, different  color, can be used on hair, can kill if consumed.","breathing out of one's mouth to extinguish candles or bubbles, is a slang word for cocaine, what the wind does","what soda is often placed in, a round container for beverages, has tabs on the top","often associated with colds, a noise one makes when they are sick, people should cover up their mouth when they cough, cough drops can help with sickness","a genre of music, open area, often includes farm and cattle, can be a place on the map (America is a country)","can be used to describe a drug (crack cocaine), can be a split between the floor, cracking one's knuckles,","a movement of the body, used as a form of entertainment or expressing onself, a hobby, a motion performed to music, what one does at a club","a meal eaten at night, normally eaten by the whole family together, one of the three important meals of the day","third planet from the sun, only planet with water, the planet everyone lives on, natural characteristics of the planet","what people walk on, can be tile, wood, or carpet, spills often take place on it","birds fly, one can ""fly"" by plane to travel, in the air, defying gravity, a slang word for cool","cloudy, hard to see, moist, can be related with scary movies","changing the way a piece of paper or clothing looks ""folding it""","doing whatever you wish, not controlled, the most valued trait of america","healthy, apples, pears, oranges, delicious, sweet,","honorary, respected, tasteful","a tool, used to drill in nails, can be harmful","strong dislike, negative feeling, anger, opposite of love","what ears are for, to recognize sounds","temporary home, costs money, where one stays while traveling, involves maids and receptionists","not yet grown up, childish, annoying, sometimes dramatic, ignorant","to scratch, an irritation of the skin, often caused by posion ivy or dry skin","to travel, set out on a quest, name of a store,","not now, at a different time, now and later candy,","rules, what people must obey in states, a set guideline","to gain more knowledge, mature, can be benificial if one ""learns"" new things","plantlike things that are often on the ground in autumn, change colors, hang off branches of trees","dishonesty, negative trait in most people,","to see with one's eyes, to admire something","to create, to work things out (make up, make a mends),","occurs on old food, disgusting, green and yellow, can cause illnesses, or sculpting something (tracing) or ""molding""","movement, used to describe how high a horse's legs go when they trot, can be a hand gesture","not standing still, exercising, traveling to a different place,","worn around someone's neck, can be diamond, gold, or metal, jewelry, beneficial for appearance, often used as a christmas or birthday gift from a husband to wife","eight legs, lives in the ocean, can be eaten by people,","not young, aging, been around for a long time, a late trend","gathering of people, often involves alcohol, loud music, balloons, a celebration for birthdays or anniversaries, the act of drinking or going out can be referred to as ""partying""","not in a hurry, polite, waiting your turn for something, a valued trait",the traits that make people unique,"flies in the air, made of metal, can seat many people, travels long distances, often mistaken for stars","a game mostly played by guys, can cause people to lose their money, cigars are usually involved when playing, or there are fire pokers, which move logs around in fires to keep the flame burning","slang term for marijuana, a metal object used for cooking, a slang term for toilet","a gift from someone, the current time, alternative word for ""here"" often used for attendance","not common, close to being extinct","someone who calls the plays in sports, often wear black and white striped shirts, blow whistles, people often get angry with them","keeps food items cold, located in most people's kitchens, an appliance","to borrow, lend a house for a short time, name of a movie","milkshake, moving someone to wake up (""shaking"" them), what one often does when they are cold or nervous","can be used for pools, often at playgrounds, landslides, to slip,","a word often used to smear butter on toast, viruses can spread or travel, one can perform a spread eagle with their legs","mental well-being, or a section of a country","a place where one waits for a train or bus, police ""station"" where cops are located, a set place for something","to explain, to predict (tell the future), ""show and tell"" is used for little kids","an object, what two people share with each other that is similar to a relationship","one who has never had sex, purity, innocence , or used to describe a non-alcoholic drink","an eruption of lava, can be deadly, very hot","what one does with their pencil, one will normally ""write"" to tell a story or send a letter to someone"65236,11/21/10 21:02,11/21/10 21:26,24,"used in construction, has liquid, has a ball, can be used to put up decor evenly","used in cooking, gets rid of vampires, is a bulb, tastes strongly, gives you bad breath","point a finger at, yell, angry","wheels, bell, helmet","teeth, scar","white, strong smelling, teeth","mouth, cold air","aluminum, holds liquid, can be crushed, can be recycled","sneeze, sore throat, choke","cowboy boots, tractor, open fields, hills, trucks","cocaine, white","studio, shoes, music","meat, potatoes, family, table","green and blue, soil, pure","carpet, walk on, lay on, mop","wings, wind, sky, free","scary, moist, lights","laundry, sheets, clean","flag, soldier, thankful","sweet, colorful, juicy, delicious","innocent, favorable, praised","construction, used with a nail, makes loud noises, used in the house","yell, scream, angry","ear, loud, music","luxurious, vacation, expensive","child, boys","scratch, red, rash","long trek, seeing new places, having adventures","time, night, procrastinate","court, lawyer, trouble","class, study, teacher, brain","fall, crunchy, colorful","cheater, bad, steal","eyes, stare, sneak","hands, create, clay","green, cheese, old, gross","air, wave","motion, dancing, running","pretty, sparkles, women and men wear them,","eight, slimy, ocean","dusty, creaky, rusty","music, dancing, laughing, drinking","virtue, mother","funny, cute, friendly","wings, metal, transportation","cards, vegas, casino","pan, black, cooking","gift, bow, excited","precious, intriguing","stripes, whistle, flag","keeps food cold, in the kitchen, big appliance, uses electricity","check, apartment, life","chocolate, cold, frosty, burger","children, laughing, swings","peanut butter, knife, bread","country, 50, region","train, gas, bus","secret, tattletale, whisper","weird, strange, unknown","pure, innocent, clean","erupt, lava, hawaii","pen, paper, creativity"66133,11/21/10 21:11,11/21/10 21:37,26,"level is a floor, there cna be different levels","garlic is a spice, put it on food, increases flavor","blaim, guilty","ride, transportation, wheels","teeth, food","change colors, laundry","bubbles, mouth","cans are aluminiun, can drink soda out of them","you do not want this, cough means a cold, happens when you are sick","hicktown, music","break, hole","music, fun, competition","food, good, family","globe, land","tile, ground","plane, birds, run fast","couldnt see, dense air","napkin, cut in half","freedom is being seperate, able to do what u want, America is free","healthy, apples, grapes","well, succeed","nail, mad of steel, heavy","dont like, argue with, dont talk to","ears, noise","trip, out of town","out of control, acting young","scratch, annoying","trip, exploration, excitement","at another time, not now","doctorite, good at arguing","Think, smart, textbook",to go,"not telling the truth, saying something untrue","eyes, direction","do something, food","green, slimy, gross","to move, signal","sway, rock, back and forth","Diamond, expensive",octupus is an animal,ancient,"fun, music, drinks","being patient, being quiet, relaxing","head, how you act","fly, sky","Poker is a game, usually bet, played with chips","round, aluminum","gift, christmas","doesnt happen often, not usual","official, rules, penalties","cold, milk, food","house, pay","salt, stir, mix","water, something you go down","sickness, spread std's","land territory, missouri","radio, railroad, union","tell on people, tell someone a story",anything is a thing,never done something,"erruption, fire","notes, pen, pencil"65263,11/22/10 13:44,11/22/10 14:13,29,"one, two, three, overcoming an obstacle,","smelly, italian, vampires, healthy, bread sticks, spaghetti, some chinese food","murder, rape, lie","rides, Katy Trail, snacks, fun","hard, blood, teeth, vampires, dog, sharks, tongue","laundry, gross smell, disinfectant","up! Kaboom! kisses, away, blow my mind","homless people, vegetables without nutrients","sick, flu, snot, germs, spit, ilness","third world, America, Europe","pop your back, break, fault","enjoyment, fun, short dresses, high heels, sweat, hot, heat","vegan, burritos, time for over eating","mother nature, plants, vegans, hippies","hard wood, carpet, sleep-overs","airplanes, birds, get away","errie, mysterious, bright lights, fear, car wrecks, feeling aggrivated","sheets, towels","of speech, utter euphoria, choices, life, america","healthy, banans, oranges, apples, pineapple, hyvee produce, vitamin c, citrus, grapefruit, bright colors","morals, God, pure, white, true, real","nail, build, to defeat, MC Hammer, pound, hit thumb, ouch, heavy, iron","hair in the drain, pet peeves","aid, comical","haunted, soap, dirty sheets, cities, country,","middle schoolers, boys","chicken pox, chigger bites,","80's band, self discovery","late, never going to happen, blow off","government, lies, requirements","words, lettes, shapes, math, theroies","fall, autumn, trees, orange, red","untrue, hypocrite, white lie, sinful","appereance, conceit, superfisial,","belive, create, sculpt, imagine","clay, create, morphe","movement, excercise, running, swimming, sweat, endorphins, freedom of body","motion, excercise, calories burning","jewlery, expensive, greed, diamond","eight legs, purple, deep ocean, buried treasure, pirates, sail boats, dolphins","people, bad drivers, wrinkles, canes, wheel chairs","fun, lots of people, alcohol, people acting like idiots, anxiety, peer pressure, drugs, birthdays","tedious, annoyance","one of a kind, unique, funny, charasmatic, pesamistic, type a, type b","ride, ticket, travel, journey, exotic places","bluff, lots of cards","head, marijuna,","Christmas, state between the past and future","jewlery, stone, rock, mineral, one of a kind","fat men, white and black, bad calls,","cold, smelly, bright, white","appartment, -out","n bake, n steak, milk shakes, maraccas, sluty rap videos","excercise, to the right, slide to the left, two hops this time, cha cha slide","peanut butter, sweet house or apartment","of mind, territory, emotional being","train, army","all, tabloids, gossip, truth","stuff, thing one and thing two,","pure, good, morals, sweet, youth, girl, Mother Mary, Christ,","lava, danger","love to write, freedom of the pen, passionate, loving, excitment, longing for, poetry"65752,11/22/10 15:51,11/22/10 16:16,25,"game, requirement, goal, section, achievement","food, pizza, vampire, seasoning, cook","murder, crime, suspect, investigation, test, witness, testify","ride, children, fun, form of transportation, wheels, pedals, handles","dog, snake, can be harmful, hospital, damage, skin can break, blood","hair, color, white, clothes, washer, dryer, clean","whistle, gum, air, balloon, enlarge, move, force, wind","aluminum, bottles, beverage, soda, contain, plastic, open","symptom, lungs, air, medicine, sickness, mucus, congestion","established, president, large, land","type of drug, window, repair, fix, bones, skull, damage","movement, way to exercise, fun, performance, theater, audience, entertainment","food, family, lunch, breakfast, meat, eat, late","round, green, blue, large, home, planet, galaxy, water, land","carpet, wood, carpenter, furnish, buffer, vacuum, clean, mess","pest, insect, travel, transportation, plane, movement, wings, flap","london, thick, moisture, eerie, hard to see, weather","crease, napkin, close up, tablecloth, sheets","liberty, rights, happiness, open, happiness, adventure","sweet, taste, colorful, good for your health, dessert","best, happy, reward, great, positive, smile, laugh, adjective","type of shark, pound, nails, wall, fix, repair, home, building, picture","despise, disgust, feelings, betrayal, emotion, deep, pain","ear, sense, smell, touch, feel, interpret, sound, music","place to stay, comfortable, beds, rooms, service","selfish, childish, behavior, hasn't fully developed, prepubescent, growth","scratch, irritate, skin, infection, rash, nails, instinct","epic, hardship, endurance, strife, goal, determination, motivation, destination","not now, sometime in the future, eventually","obey, enforced, judge, jury, court, rules, prohibit, abide","develop, teachers, students, interaction, environment, mind, intelligence","trees, fall, autumn, changing colors, cycle, food for insects","deceptive, hides the truth, unreliable, lack of trust","appearance, observe, study, eyes, sense, watch","create, bake, construct, skills, change","damage to health, old, moist, green, fungus, smell, fuzz","movement, muscle, momentum, physics, education, force","muscle, momentum, physics, force, body, transportation","beautiful, woman, gaudy, silver, gold, present, gift, affection","animal, ocean, living, eight arms, suction cups, large","used, tattered, worn, progression of age, elderly, grandparents","fun, wild, friends, family, gathering, music, dance, drink, relax, enjoy, smile, laugh","reserve, time, quiet, wait, reward, eventually, virtue","type, behavior, social, positive, negative, defines who we are","transportation, fly, wings, passengers, suitcases, people, destination","game, bet, fire, gambling, cards, smoke, drink, money","type of drug, cook, container, hot, stove, oven, food, storage, metal","past, future, time, gift, kindness, holiday, affection","endangered, animal, near extinction, precious, valuable, gold","sport, game, conduct, score, whistle, blow, numbers, uniform","appliance, home, keeps food cold, beverage, ice, temperature","borrow, temporary, movie, room, only for a moment","rattle, rapid movement, shiver, muscle, nervouse, scared, fear","fun, children, playground, recreation, movement, gravity, pull, slippery","butter, jelly, jam, bread, movement, smooth, knife. across","the united states, president, situation, circumstance, position","train, pitstop, people, travel, tickets, point, destination","speak, communicate, mouth, answer, explain, words","unidentified object, unknown, unimportant, useless, doesn't matter","sexuality, sex, male, female, abstinence","erupt, dangerous, hot, lava, science experiment, children, school, red","scribble, creativity, express, pen, pencil, paper, skill, school, learn"