id_code,start_time,end_time,duration,level,garlic,accuse,bike,bite,bleach,blow,cans,cough,country,crack,dance,dinner,earth,floor,fly,fog,fold,freedom,fruit,good,hammer,hate,hear,hotel,immature,itch,journey,later,law,learn,leaves,liar,look,make,mold,motion,movement,necklace,octopus,old,party,patience,personality,plane,poker,pot,present,rare,referee,refrigerator,rent,shake,slide,spread,state,station,tell,thing,virgin,volcano,write64120,11/22/10 19:15,11/22/10 20:37,82,"is a tool, made of metal or wood, contains liquid, sold at hardware stores, used to make things flat or perpendicular, handheld, often has measuring increments","grows in the ground, breaks into cloves, tastes very spicy, used to cook with, is white, requires moisture to grow","to blame someone, assumes someone is guilty without evidence, often made when a law has been broken.","has two wheels, a handlebar, a seat, pedals, a chain, uses a system of gears, usually has brakes, different variation for mountains or roads, are sold in stores, convenient means of transportation, used for competitive sport.","used as self defense, mechanism for consuming food, involves bringing teeth together, inflicts pain.","used to clean floors, cleans stains, removes color from clothes, can be used to make hair blonde, is poisonous to eat.","pushes air out of mouth, cools down food, is rude in china, involves movement of air.","made of tin, hold food goods, can be reused as a container for nails, are recyclable, come in varying sizes.","a symptom of being sick, they can be heard, mucus is coughed up. alleviated by cough drops.","has a government, ours is made of states, usually has an army, inhabited by people, contains different sights, has its own culture, usually has speaks one language, has a flag. has a history.","the gap between, can break objects, represents old age, a lack of wholeness.","a motion of the body, corresponds with music, can be synchronized with other people, is commonly done at parties.","eaten late in the day, usually evening time, is preceded by breakfast and lunch, usually is the biggest meal of the day, eaten at a table, before sleep.","Large, round, populated, composed of water and land, cold at north and south, warm near equator, has an atmosphere, hosts living organisms, has a liquid core, part of a solar system.","is stood on, can be made of dirt, wood, or tile. cleaned with a mop.","a type of insect, has six legs, two wings, is very common, throws up every time it lands, small, black, likes to swarm.","hard to see through, opaque, made of moisture, cooled down, close the ground, a type of cloud, looks smokey.","a crease in something, comprised of an angle, used in origami, used to keep laundry organized.","having rights that allow you to do as you please, given by a country, upheld by the law, differ state to state.","contains seeds, grows on trees, can be consumed, are often sold at grocery stores, are used to cook with, are sweet tasting.","not bad or evil, does the right thing, is honest, trusting, helps more than hurts, has positive intentions.","a tool, used to place nails in wood, also used to pull nails out of wood, has a wooden handle with a metal head, staple of any tool kit.","strong dislike, very passionate, opposite of love, feels uncomfortable, makes people mad.","uses your ears, interpretation of sound waves into language, utilizes brain.","a big building, more than one story, people sleep there, people pay to be there. sometimes have pools. used while traveling away from home.","Lacking seriousness, characteristic of young people, acting inappropriately, not yet fully developed","is unsettling, must be satisfied by scratching, is on the surface of the skin, caused by irritants like poison ivy.","moving from one place to another, not easily completed, involves hardship, has some ultimate goal.","is at another time, a future time. past the time previously discussed, may be at night, or when it has become dark outside.","made by congress, defines what we can and can't do, is interpreted by the supreme court, upheld by the executive branch. can be interpreted in different ways.","acquiring knowledge, acquires knowledge, often at schools, but everywhere growing up, results from mistakes.","grow on trees and other plants, usually green, contain chlorophyll, dry out and die in the fall, turn brown/red/yellow, fall to the ground, are raked up, sometimes burned, feed insects and herbivores.","does not tell the truth, usually received negatively, exaggerates statements, makes themselves look better than they are, does not follow through with promises.","indicates how someone feels, made from facial expressions, is universally understood around the world, is projected towards other people as communication.","describes the brand of something, a type of car, where the object was created.","a type of fungus, grows in moist areas, can be toxic if inhaled, common in showers, grows on old food, usually looks ""fuzzy""","is made through movement, fast or slow, directional,  more motion generates heat","An act of motion, directional, can be achieved using vehicles, can be achieved on foot, getting somewhere new.","worn around the neck, usually is jewelry, is valuable, has a string or links, two connecters. worn by people.","Has eight tentacles with suction cups, lives in the ocean, eats mollusks, squirts ink, varies in color, is eaten in certain parts of the world.","no longer young, has been around for a long time, worn out, tired, broken, loses novelty.","where people go to socialize, often involves drinking, celebrates special occasions, sometimes presents are exchanged.","has the ability to wait a long time, not hurried, not easily upset, very flexible, outgoing around people.","describes a persons mannerisms, can be kind, patient, etc. the way someone generally acts.","a vehicle of transportation, flies through the air, fastest way to get somewhere, has two wings, has an engine, is manned by at least one pilot.","made of metal, used to control fires, pointy tip, also a game played with cards, extremely competitive, five card variation, seven card variation,  with different rules","used to cook food, sits on stove, heats up fluids, has a copper bottom, has an accompanying lid.","something you give to someone else, usually wrapped in paper, has a bow, given away on christmas and other special occasions. has a to/from tag.","hard to find, is obscure, is old or no longer made, is valuable, is unique","judges sporting events, observes games and upholds the rules, wears black and white stripes, has a whistle, makes money.","is tall, usually has accompanying freezer, stores food and drink, is magnetic, keeps things cold, runs on electricity, generates ice.","given to a landlord, usually in the form of money, is exchange for living somewhere, gives you access to a location.","made of ice cream, tastes sweet, has a cherry on top, is mixed with milk, comes in a variety of flavors, part of americana","is made of metal or plastic, has a smooth angular surface, found on playgrounds, has a ladder side. is sat on and ridden downward.","measures distance apart, easy to run over bread, plans or blueprints, sometimes flavorful.","in the U.S. they are districts of the country, contain their own governments, have a state motto, a state bird, a state rock, etc. Are broken up into smaller districts and towns, an area of land.","facilitates transportation, trains stop and go, people buy tickets there, has a building, and railroad tracks, delivers you to another station.","giving away information, done using voice, can be written, can be typed. is received by someone through hearing if spoken.",vague term that describes a noun. depends on context. usually and object of some kind.,"Lacking in something, non-alcoholic, someone who has not had sexual intercourse, young people.","is a type of mountain, releases lava, smokes, can explode, sometimes causes earthquakes, often found around pacific rim.","created with pen or pencil, on paper, can make a letter, can be part of artwork or advertising, made up of alphabetical letters."66058,11/22/10 20:16,11/22/10 21:35,79,"keeps things in balance, strong, bubble","tasty, stew, powder, sauce, bread, toppings","angry, mad, upset, hasty, wrong, trial, judge, jail, prision","21 speeds, bmx,moutain bike, tricks, ramps, jumps, motorcycle","size, hurts, dogs, snakes, animals, pets, mailman, pizza, shrimp","clorox, cleaner, smells, cheap, kills things, hair, blond,","wind, hairdryer, exhale, cool down,","trash, soda, homeless, shopping carts, food, industry, can opener, soup","sore throat, cold,","United States, war, guns, tears, blood, governent, the law, freedom, whole, large area","cocaine, drugs, illegal, black, cops, addicted, violent, butt, plumber","with the starts, tv shows, fun, swing, line, classes, styles","date, best meal, Meat, steak, fancy, tv, candles, time, home cooked","rotation, large, alot of water, islands, sea, axis, green, animals, beautiful","wood, concrete, carpet, wet, oak, stain, buffer, polix, wax, sweet, mop, track over","planes, birds, superman, rockets","cloud, early mornings, thick, fog lights,","five, cloths, towels, napkins, sheets, crease, lines","feel freedom, no worries, all your neads meet, to be rich with life","strawberries, banannas, berries, mango, drinks, flies, bugs, healthy, colorful","positive, battery, kind, holy, church, family, food, feelings","tool, nails, carpenter, handy man, claw, autobody, toolbox, common","Angry, selfish, disklike, races, all ages, effects everyone, health risk","listen, ears, music, words.","room, room service, fancy, comfort, pool, cable, free breakfast","little kids, selfish, pushy, loud, anoying, mean","poision ivy, hives, burn, pain, cream, relief, grass, outdoors, ants, bugs","moving, center of the earth, movie, waterpark, jurassic park, forest, fun, friends, treasure","now and later, candy, goodbye, in the future, evening, not now","dog, sherrif, cops, western movies, responsibility, corrupt, guns","school, spanish, english, monkeys, children, power, grades, form, art, abailty to do","fall, rake, work, horrible, cold, bags, leaf blower, fun, compost","con man, car dealerships, weather forcast, disshonest, mean, white, cheaters","landscape, the look, appearance","shift, to do, build, invent, use hands, create, produce, cookies","clay, facial, reproduce, liquid to sold, compress, oil, art","energy, movement, legs, run, jump, gravity, resistance, wheels","wheels, energy, parts, body, living things, machines","jewlery, diamond, pearls, chain,","ocean, legs, tenticles, books, movies, food, killer,purple, deep underwater","men, home,","animals, fun, dancing, drinking","virture, waiting, calm","bubbly, sweet, kind, fun, ditzy, funny, woman, outgoing, everyone","crash, air, turbine, paint, wing span, airports, costly, passangers","face, cards, chips, millions of dollars, bet, gamble,","illegle, high, stoners, hippies","christmans, birthday, weeding, something nice, expensive, creative","special, fancy, delicate, metal, pawn stars, collectors, coins, toys, guns, cars","basketball, sporting games, judge, offical, accurate, equall,","sears, running,","landlord, payment, responsibility, evection, house, car, boat, books, apartment","a leg, bake, crumbs, icecream, strawberry, good, health","playground, baseball, little kids, water, tunnels, twists, fun, excitment","jelly, sandwich, to seperate","united, 50 of them, senate, government, represenative, building","gas, convient, weigh, trucks, service, cars, police, news","to express, communicate, language","object, thingy majig, candy bars, lever, button, person, animal","pure, abstanance, healthy, woman, christian, good, self respect","lava, hot, colorfull, powerfull, amazing, red, coal, boil, crack","to create, write image, pens, pencils, oil, paper, tree, creativity,its free, read"65851,11/23/10 10:03,11/23/10 10:55,52,"used in construction, usually metal, tests if a surface is parallel or perpendicular to the ground","odorous, vegetable, used in cooking","call out, bismirch","can have motor, can have pedals, 2 wheels","used to eat, defense mechanism, instinct","caustic, alkaline, stain-remover","exelling air, opposite of suck,","aluminum, non-perishable","expel air forcefully, clear airways","has a government, has laws, wilderness, untamed","crevasse, cleaved in two","art, movement, expression","meal, lunch","solid, dirt, sturdy, circular","stood upon, sturdy","in the air, wings","water vapor, suspended above ground, opaque","to crease, to half","independence, autonomy","grows, has seeds, trees or bushes","positive, opposite of bad","used in construction, metal or rubber, heavy","intolerant, unkind","auditory, interpret sound waves","can be rented, temporary","undeveloped, irresponsible","annoying, constant","a trip, expedition, heed supplies to complete","after a period of time, not now","rule, used in arbitration","to grow, become more educated, to advance","used in photosynthesis, contain chlorophyll, contain fibers","untrustworthy, deplorable","viewing, seeing, witnessing","create, to construct","fungus, can be harmful, can be beneficial","not staying in place, momentum, action","motion, action, not staying in place, momentum, velocity","encircles the neck, jewelry, ornamental","cephalopod, 8 limbs, excretes ink when distressed","wisdom, experience, frail","social gathering, usually jubilant, boisterous","enduring, tolerant",how a person expresses themselves,"has coordinates, metal, aerodynamic, used to fly","can be a card game, can be a metal rod, stirs fires","pan, metal, used in cooking, usually in a kitchen","now, gift, to show","unique, hard to obtain","arbitrator, judge","keeps food cool, in kitchen, metal","to borrow, temporary","to move back and forth, a mixture, can be fruity","minimal friction, movement","layed out, expanded, flat","a configuration of matter, a condition","meeting area, gathering point, building","to talk, confide, direct","object, idea, noun","unaltered, unadulterated, not tampered with","mountain, escape point for lava","record, uses writing utensil"66451,11/27/10 14:47,11/27/10 15:17,30,"flat, tool, used in construction, bubble, liquid inside with air bubble, two lines to indicate levelness","bulb, strong odor, strong taste, plant, ingredient","speak against, argument","transporation, two wheels, pedals, force, chain","teeth, force, pain, penetration, indentation","hazardous, chemical, white, blonde, clothes","lungs, air, force","sealable, holders, tin, cylindrical","irritation, soreness, ill, projection of saliva","inhabitants, several districts, anthem, flag, nationalism, land mass, borders","break, cosmetic malfunction, seperate","grace, practice, rhythm, fluid, beat","food, energy, consumption, prehension, mastication, degludation","planet, solar system, life-sustainable, water, land, atmosphere","pushes back, down, foundation","wings, lift, wind resistance, thrust, physics, birds,","moisture, dense, less visibility, drop in temperature",decrease size,"liberation, opposite of enslaved, rights, america, comes at price","sweet, natural, juicy, vitamins","warm, light, opposite of bad, friends","tool, blunt object, hits nails, prys nails loose, rubber grip, metal","intense feeling, disgust, no likeness,","noise, sound, ear, brain","payment, bed, television set, indoor pool, lodgings, bathing area, stairs, elevator, front desk, room service, lobby","not mature, young, ignorant, scared","low level of pain, blood to surface of skin, relief of pain","somewhere else, far away, adventure","future, not now, prolonged, procrastination","rules, enforcement, punishment","experience, changing, adapting","fall, trees dying, discoloration","lawyer, washington d.c., not truthful, withholding the truth","eyes, eye movement, color, light, dark, shades, expression, emotion","create, build, new, put together","unhealthy, expired, airborne, damp, dark","physics, math, space","motion, all directions","body wear, circular, oblong, design","eight legs, sea creature, tentacles, suction","not young, seasoned, wise, changed","fun, music, friends, conversation, refreshments","wisdom, maturity, silence","not physical,  identity, unique","thrust, flying, great distances, fast, modern, jumbo, altitude","card game, probability, math, strategy, lying","metal, tool, cooking, container","now, in the moment, instantaneous, gift, sign of affection","hard to find, not occuring often","stripes, whistle, officiating, object of anger, neutral","cold, preservation","payment, monthly, living expense, apartments, cars, money","back and forth motion, mix, atoms smashing together","down, motion",betting term,"a division, self governing, popular sovereignty","building, train, gas",speak to someone,object of any nature,"pure, respectable, believer, self-disciplined","eruption, heat, lava, tall, magma, ash, new beginning, destrucion","mark, language, recording"66541,11/29/10 11:56,11/29/10 12:28,32,"flat, level, used by carpenters, construction workers, men, green bubble","kills vampires, smelly, strong taste, used in italian food, used by chefs, is sticky when crushed","assigns guilt or blame, usually done emotionally, emphatically","two wheels, fast, economical, green","itchy, infected, bleeding, inflicted by dogs, mosquitos, babies,etc","clean, burns, turns things white","airy, forceful, sometimes from mouth, sometimes from fan","made of metal, sometimes they contain soda, sometimes food, can be recycled, sometimes for money","illness, violent, hacking-sound, abrupt","terrible genre, sell outs, glorifies mediocrity","stimulant, let's water in through the windshield, probably need to pull your pants up","technical, flexible, physical, feminine, tights","in the evening, at the dinner table, served by mom, enjoyed in the company of family","good for planting crops, also inhabitable, lots of nutrients or resources","flat, even, on the bottom, used by feet mostly","wings, six legs, bulgy eyes, vomit mouth","visual obstruction, can be steamy, near lakes or rivers","halved, creases, something that happens to your clothes","america, isn't free","has seeds, usually sweet, comes f rom a tree","doing what's right, something pleasant, something satisfying","Used in making things, sometimes breaking things, carpenters, dads, paired with nails","immature, fear, misunderstanding","Used by ears, sometimes felt, activated by soundwaves","rundown, dirty, unkempt","acting in your own self interest, incapable of seeing other points of view, crude sense of humor","needs to be itched, caused by infections and mosquito bites","takes a long time, usually covers a wide distance","now and..., near future, opposite of before","must be followed, if not, there will be negative consequences","intake of knowledge, produced by conditioning and reinforcement","colorful in autumn, green in spring, fall to the ground, veiny, chloroplasty, provide nutrients","truthless, often self-serving, can be protective","glance, sometimes has a facial expression, somtimes can be rather quick","to build, the reproduce, to recreate","organic, smelly, shape, default","going fast, blurred","motionlike, fast or slow, repetitive or abrupt, ambiguous","circular, feminine, dressy","slimy, from the ocean, many tentacles","graying/losing hair, repeating yourself, waking up early","food, excessive intake of, what the cool kids do, typical","virtuous, holding out for the future","Sense of humor, associated with interests, serious, solemn, lighthearted","a flat, or has wings, can fly","associated with gambling, mostly men who are smoking, wearing sunglasses indoors, and visors","used to cook with, sometimes to smoke, illegal or delicious","giving, selfless, christmas time","high value, hard to come by, money","black and white stripes, has a whistle, usually an older gentleman","cold, metallic, nourishing, used by mom, left open by everyone else","bad idea, no equity, monthly installments","creamy, smooth, cold, delicious, found at ice cream parlors","fun, for kids slippery, hard to climb up","covers, goes well on toast","bounded by landmarks such as rivers and mountain ranges, otherwise the boundaries are arbitrary","rest, destination,","Used by the tongue and mouth, activates soundwaves, spoken words, informative","not an idea, not a place, usually an object, inanimate","innocent, good in women, bad in men","violent, explosive, dangerous","has words, language, generally comprised of coherent sentences that form paragraphs"63820,11/29/10 12:05,11/29/10 12:11,6,Video Games,White,trouble,two wheels,Teeth,ruins clothes,bubbles,can drive,cold,United States,cocaine,Music,supper,lots of water,Tiles,birds,Hard to see,laundry,rights,healthy,great,Tool,Envy,Listen,party,boys,scratch,Adventure,time,lawyer,School,fall,men,see,bake,old food,Fast,run,pearls,eight,grandparents,drinking,waiting,outgoing,fly,blackjack,tea,Christmas,meat,whistle,cold,Money,booty,playground,peanut butter,missouri,gas,secrets,noun,no sex,erupt,pen64711,11/29/10 12:12,11/29/10 12:31,19,"balances, fair v. unfair, steps","tangy, flavorful, spice, plant, can turn in to powder, used in food,","anger, jumping to conclusions,","metal, movement, air whipping by you","violent, pain,","whiten, lighten, smelly, chemically, dangerous","innocent,","tin, metal, cold, smooth,","sicknes, cold chills, fever","international, global, order, boundaries","dark, cement, ground, cold","moving, fun,","filling, satsifaction, warm","home, diverse,","hard, tile, carpet, hardwood, feet, sturdy, immovable","air, buzz, small, winged, clouds, airplane","unclear, uncertain, white, no visual, limits senses, cold","give up, make smaller, compact","America, power, happy,","sweet, juicy, textures vary, smoot,  rough, fuzzy","happyness, smiles, warm","hard, cold, violent","cold, fire, blank, anger","ear, sound, sounwaves, response, senses, noise, sounds","sleep, comfort, clean, service","children, noisy, irresponsible,","annoying, nagging,","completion, end, life","procrastination, put off, conviences","fair, balance, just, legal, safety, blind, justice","teach, absorb, in take","crunchy, brown, red, green, yellow, vibrant","dirty, scummy, low down, no morals","sense, eyes are used,","do, action, create","fuzzy, green, white, damp, dark","movement, visual, feel air moving","motion, feel wind, journeys","gift, love, women, cold, rough to touch, metals","sucking, dwelling, scary, frightening","wrinkled, smelly, color changed","loud, crowded, yelling, packed, laughing, dancing, music","caring, understanding, familiar","important, invididual, unique,","clouds, steel, loud, humming","bet, gamble, win, lose, luck of the draw,","metal, hot and cold, heavy","now, here, not the future or past, gift,","important, valuable, uncommon, not done","black and white, order keeper, enforcer, whistles","cold metal, preserving","money, home, house, dues to be paid","cold, icy, shivers, goosebumps.","innocence, laughing, plastic, hard, movement, air","thin,","govermental, boundaries","base camp, meeting place, formal",release,"nondiscribt, general, generic","pure, untouched, innocent","hot, fire, lava","words, communication"