Play,"for fun and relaxationdone on grounds,in house or laptops,etc"
Play,"kids, playground, laughing, fun, games "
Play,"football, basketball, sports, playmaker, quarterback, coaches, ball, players club, playing the field "
Play,"Something done usually by kids when they are board. Associated with games of all ages such as playing hockey, football etc. Can also be what one may go watch for entertainment where people act out scenes to a written story."
Play,"ground, swing set, little kids, having fun"
Play,"outside, games, board games, sports, active, moving around, playing with others "
Play,"exercise, you can be involved with games, it can mean kidding"
Play,"play at a park, a theatrical performance, toys"
Play,
Rights,"correct, amendments, rules, laws"
Rights,"something that everyone is entitled to, first ten amendments to constitution, "
Rights,"is something everyone has, can be taken away, provided by government and nature, "
Rights,The ability to do as you would like within the restraints of the law
Rights,"wrongs, what youre allowed to do, bill of"
Rights,"civil rights, laws, Congress, judges, lawyers, police, privilege, rules, freedom, permission, president, power, correct, true, valid"
Rights,"justice, Bill of Rights, 1st Ammendment, freedoms, Declaration of Independence"
Rights,"our justification from someone else of what we can do legally, what we rely on to keep us free, or take many ""rights"" in your path"
Rights,what people can't take away from us
Rights,"laws allowed to citizens, Bill of Rights, rights reserved to the people"
Rights,"fundamental part of democracy, can be violated, can be protected by law, can be abused"
Rights,"constitution of the united states, we all have rights, equal rights, 1776, things that we are all born with."
Rights,"those roles given to a group of people which cannot be taken away, a free choice which people are given to make"
Rights,"handed, freedom, side, left, do what you want"
Rights,freedoms that you are given
Rights,"someones rights, right and wrong, opinions"
Rights,"freedom, innocent untillproven guilty, a lie, a joke"
Rights,"legal or social principles, things we are allowed"
Rights,"freedoms, things that Americans are entitled to, Civil rights, right to vote, freedom of speech, freedom of religion, right to bear arms"
Rights,"what your borned with, things you can do by law"
Rights,"what you're allowed to do, what is expected from citizens"
Rights,"freedom of speech, something that can't be taken away, Bill of Rights, freedom."
Rights,"Constitution, Bill of Rights, Founding Fathers, fighting for freedom."
Rights,"fair, everyone has these, moral, ethical, good, legal"
Rights,"rights given to you, cant be removed"
Rights,"ideas that are believed to belong justifiably to every person, are used in justice system, provide conformity and value and morals"
Rights,"a legal ability, forms of respect, should belong to everyone, fought over, creates freedom"
Rights,"equal, even, good, proper, just"
Rights,"Abolishment I'd slavery, USA, women"
Rights,"human freedom, entitled to your own opinion, constitution"
Rights,-legal-equal
Rights,"principles, everyone is entitled to them, shouldn't be taken away"
Rights,"human, laws, false, politcal, court, freedom, speech, D. I., government."
Rights,"entitlements, eithical principles, freedoms, social rules born with"
Rights,being entitled to do certain things
Rights,"constitution, happiness, life, freedom, America, religion"
Rights,"is needed, is desirable"
Rights,"privileges, granted to people based on constitution"
Rights,"freedom, u.s.a"
Rights,its a hand or a trun
Rights,"something we have, stuff we can legally do without being punished, something the state has, are written, freedom"
Rights,"Declaration of Independence, Constitution, equal, destrimination, wrongs."
Rights,"Freedoms, equality, independence, safety, human desires"
Rights,"supposed to be for everyone, can be taken away which defeats the purpose of the word, always sought after yet rarely found"
Rights,something everyone has
Rights,"what is good or proper, what we fight for, what can't be taken away."
Rights,"the standardization of fairness to all; a certain number of beliefs or practices that arises from an inherentness of sentient intelligence whereby we designate the deservedness of all to be equal; brings to mind the Bill of Rights and the Constitution/Amendments; how rights are abused; the original rights that were proposition by the founding father (right to life, liberty, and the pursuit of possessions) and a theoretical question of whether these rights were ever attained, are still considered in effect, or if they have been manipulated, abused, or absolutely dissolved in a power move by government forces as they grow ever more paranoid in their pursuit of self-preservation while they forget the lessons from which this great nation was forged."
Rights,"used to give people justice, civil, "
Rights,"is what is considered moral or immoral, usually debatable ex. female rights, opposite of wrong"
Rights,"People are born with certain rights, the Constitution gives us more rights but they are governed by the government to promote equalness."
Rights,"Deserved by everyone, the ability to be free"
Rights,laws self proclaim
Rights,essential for living in societyaccompanied by duties too
Rights,"what you can do, freedom, rosa parks, segregation "
Rights,"to party, freedom of speech, unjust cruelty, rights to a lawyer, government, judges, court, jury"
Rights,Something people have in regards to the law and how they can get into trouble.
Rights,"civil rights, native rights, individual rights"
Rights,"Miranda rights, constitution, bill of rights, personal rights, freedoms"
Rights,"Constitution, god giving, freedom."
Rights,what we are able to do without breaking the law
Rights,
Ring,"sound, jewelry, circle, commitment, work "
Ring,"gold, circle, piece of Jewry, symbol of love and friendship"
Ring,"is an object that has a closed connection, can be jewelry for fingers, can be place boxing matches are held"
Ring,"circle, neverending, commitment, a symbol for marrage"
Ring,"engagement, around the rosie, wedding"
Ring,"wedding, marriage, promises, friendships, white, diamond, ruby, shiny, circular, fancy, divorce, expensive, jewelry, fingers, lips, toes, "
Ring,"worn on hand, worn on toe, is pretty, has jewels, diamonds, pearls, is shiny, round"
Ring,"a circle of metal to go around a finger, usually symbolizing meaning behind relationships, or the noise that comes from a telephone or bell, to alert"
Ring,"metal, diamond, love, happiness,"
Ring,"wedding ring, ring of fire, "
Ring,"used to symbolize marriage or other commitment, used as jewelry for decoration, is a sound that a bell makes, is also a sound that a phone makes"
Ring,"wedding, proposal, engagement, marriage, husband, wife, family, promise."
Ring,"piece of jewelry worn on the finger, a circle around another object"
Ring,"diamong, silver, gold, pretty, cost a lot, has a meaning"
Ring,"a circle, a place where boxers have their boxing matches, something you get as a gift or for getting married"
Ring,"marriage, a promise, a commitment, jewelry, fashionable, target"
Ring,"engagement, commitment, relationship, criminal"
Ring,"symbolic for marriage, used as a gift, purity ring, some are expensive, diamonds may be in them, class ring, jewelry, circular, put on a finger or a chain around the neck"
Ring,"worn on fingers or toes, worn in ears, used as a sign of engagement, worn to show marital status, made of metal or plastic, have precious gems in them, what a telephone does, where a circus takes place in"
Ring,"wedding, boyfriend, jewley, dimond, pretty, all different sizes and prices, silver or gold"
Ring,"a circle, could go on your finger or toe, is a shape"
Ring,"promises, marriage, love, commitment,beautiful, diamonds, expensive, you've found ""the one"""
Ring,"engagement, significant meaning, presented to a person, annotated meaning for promising, holds significant meaning to couples and during weddings, round."
Ring,"wear on your fingers, wedding ring, phone ringtone, circle, loop, band, hoop"
Ring,"something that you wear on your finger, means something special, gift, commitment"
Ring,"is a circle that goes on a finger, represents commitment sometimes, is used as an accessory sometimes, is made of gold or silver sometimes, is made of cheap metal sometimes"
Ring,"a band, a circle, can be worn, made of many materials, created by humans, round, "
Ring,"it is round, it is any color, it is placed on ones finger, it is smooth "
Ring,"doorbell, telephone, high pitch "
Ring,"shiny, diamonds, associated with weddings or love, expensive"
Ring,-bell-phone-loud
Ring,"an endless circle, a piece of jewelry, the sound a phone makes when someone is calling"
Ring,"wedding, cirus, circle, gold, sliver, diamonds, games, forever."
Ring,"worn on finger, can be used as fashion accessories, used during proposing and marriage ceremonies "
Ring,"valuable, made of metal, diamonds, used for proposals, used for special occasions, brass, gold, silver"
Ring,"wedding, finger, type, jewelry, daily, hand"
Ring,"is made of metals, is expensive, signifies love, jewelery, is worn on fingers by both men and women"
Ring,"love, harmony, weddings, connection, security"
Ring,"marriage, diamond, white gold, special, fiance"
Ring,bell
Ring,"accessory, made of many different materials, a circle, wear on your finger, something you propose with, comes in different sizes, is small"
Ring,"wedding, a promise, love, stylish, gold or silver, diamonds, jewels."
Ring,"Sound, jewelry, loud, soft, bright, dim, sparkly, shiny, expensive, cheap, cellphone, house phone, calling"
Ring,"worn on finger, symbolizes comitment, creates a bond, feels hard, feels cold"
Ring,"proposal, diamond, gold"
Ring,"is a circle, is a symbol of love, is never-ending, is an infants toy, is a flotation device, is a piece of jewelery."
Ring,"a ring is a circle with a hollowed out center; generally a piece of jewelry worn on a finger made from precious metals such as gold, platinum, or silver which is meant to convey love; a symbol of love as a never beginning never ending emotion; a way to deduce the age of a tree by it's ""rings""; ring is also used to mean arena for civilized combat originally for boxing but now also incorporates media sensationalized programs such as professional wrestling and MMA (even though the shape of the ""rings"" in these two are square and octagonal, respectively)"
Ring,"can be gold or sliver, a circle, worn on a finger, can be a symbol for engagement or marriage"
Ring,"engagement, promise, is meant to show feelings, is meant to show ""unending love"", circle, telephone ring lets you know someone is calling, "
Ring,a piece of jewelry someone would wear around their finger
Ring,"Movie, marriage, wedding, love, diamond, big, Lord of the Rings"
Ring,dinonds love happy forever
Ring,jewellery
Ring,"class ring, engagement ring, wedding ring, usually on youu ring finger. promise ring."
Ring,"worm, wedding, promises, diamonds, pretty, makes you finger green if its cheap, 4th finger, toe ring, scary movie"
Ring,"Circular, can be an object worn of a finger, toe, ears, nose, lip or bellybutton (or almost any area of body these days). symbol of eternity, exchanged at weddings and proposals. Given out for rewarding efforts such as championship games."
Ring,"finger, marriage, promise, commitment"
Ring,"ring finger, shiny, carot, diamond, wedding band, decorative, meaningful, worn my people, any finger on hand, toe ring"
Ring,"something shiney, something expenceive, something very symbolic"
Ring,a symbol of love and a commitment 
Ring,
Sad,"unhappy, depressed, blue, despairing, weeping, troubled, down, gloomy, low, downcast, heartsick, grieved, bitter"
Sad,"frown, depressing, momentary, facial expression, as a result of something happening "
Sad,"is an emotion, frowning, tears, lethargic feelings, pessimism, follows unhappy events"
Sad,"emotion, negitive, war, concequence, "
Sad,"crying, losing a loved one, a break up, not going your way"
Sad,"Blue, depressed, alone, broken hearted, crying, pain, anger, break up, death, funeral, disappointments, unfortunate"
Sad,"gloomy, upset, mourning, crying, death, bummed out, bad circumstance"
Sad,"the emotion opposite of happy, to feel blue, many things can cause this, usually from another person, in need of a cure, usually obvious through facial expressions and body language"
Sad,"hopeless, cry, "
Sad,"cry, loss of loved one, giving up something important, "
Sad,"is a negative emotion, has a facial expression associated with it, indicates problems, causes people to cry"
Sad,"happy, depressed, hard times, guilty, tears, crying."
Sad,"upset, disappointed, lathargic, frowning, let down"
Sad,"me, being unsucessful, grades, loosing someone, mood, bad"
Sad,"gloomy, upset for some reason, emotional"
Sad,"upset, not happy, crying, a fight, bad relationships, trust gone"
Sad,"down time in life, a feeling, opposite of happy, lonely"
Sad,"unhappy, crying, depressed, tears, blue, not enjoying oneself, many causes of saddness- death, fights, breakups, etc.."
Sad,"emotion, frowning, upset, crying, sorrow, opposite of happy, down in the dumps, the color blue"
Sad,"Opposite of happy, negative feeling, not in a good mood, "
Sad,"is an emotion, similar to sorrow, is a feeling, the antonym is happy"
Sad,"depression, tears, stressful, unhappy, alone, funerals, failing, separation from loved ones"
Sad,"an emotion, a state of being, physical mood, depression"
Sad,"feeling of sorrow, unhappy, gloomy, miserable, depressed, down, crying, tears"
Sad,"crying, tears, emotional, hard to cheer up"
Sad,"is an emotion, provokes tears, happens when someone or something upsets us, needs comfort"
Sad,"an emotion, like depressed, caused by loss, is felt, is a physical feeling, is a mental state "
Sad,"depressed, mopey, old"
Sad,"depressed, unsatisfied, something bad happened to you"
Sad,"upset, unhappy face, things could be better, loss of something, pregnant women do this"
Sad,-depressed-
Sad,"upset, unhappy, sometimes causes tears, depressed, opposite of happy, can be the result of an unexpected death or someone leaving, unexpected breakup"
Sad,"mood, crying, girls, drama, pain, upset, hurts."
Sad,"everyone experiences it at times, tears, feeling down, not happy"
Sad,"upset, not happy, hurt, emotion, frown, crying, "
Sad,"lonely, child, tears, frown, uphappy, death"
Sad,"is a frown, brings tears, occurs after death or other extreme situations, can cause depression"
Sad,"not happy, lonely, hurt, confused, lost, scared,"
Sad,"unhappy, feeling, cry, pouty face,depressed, hurt"
Sad,when you got bad news
Sad,"an emotion, something bad happened, occurs in people, a way to describe how you feel, "
Sad,"it is an emotion, tears, people not getting their way, depression, death."
Sad,"Mourning, pouting, unhappy, melancholy, nostalgia, blue, love, depression"
Sad,"lonely, feels cold, feels alone, looks blue, creates or created by depression, is an emotion, usually avoided"
Sad,"is an emotion, describes how people feel when something bad happens, makes people cry"
Sad,"is an emotion, is how you feel when something bad happens, is a frown."
Sad,An emotion; accompanied by disappointment or grief; usually follows anger or perpetuates anger; a general state for those with depression; usualy alleviated by mild to moderate pleasure or self indulgence; generally an acute state of mind.
Sad,"an emotion, a feeling, upset, crying, tears, broken heart, loss"
Sad,"frowning, is an emotion, unhappy, related with tears, not pleasant "
Sad,"a feeling, when someone feels blue or think of depressing memories or thoughts"
Sad,"Sad face, bad, crying, bad happenings and circumstances, unfortunate"
Sad,"tears, crying, depressed"
Sad,lonelinesstears
Sad,"tears, when something upsets you."
Sad,"cry, cheated on, death, darkness, alone"
Sad,"an emotion, unhappy emotion, something you feel when things go wrong or someone dies."
Sad,"Tears, Fear, Depression, Anger, Upset, Distrust"
Sad,"mood, look on your face, sad day, has a frown on his/hers face"
Sad,"an emotion, watching a fat guy run, being shot down by a girl, bad test score"
Sad,"not happy, not content, a low unhappy feeling"
Sad,
Shoot,"blast, fire, gun, hit, kill, open fire, trigger, injure, murder, set off"
Shoot,"aim gun and release bullet, injection of drugs or medicine "
Shoot,"is an action, generally in reference to a gun, can shoot other things (i.e. -bows), generally associated with hunting or crimes"
Shoot,"gun, power, pain, hunting, aim, survival, target, game, camoflauge"
Shoot,"basketball, guns, ask a question"
Shoot,"gun,murder,basketball,ball,crime scene investigation,police,gun man,killer, dunk, projectile, catapult"
Shoot,"gun, cowboys, explosion, ""it's a draw,"" crime, in East St. Louis, murder, "
Shoot,"from a gun, shoot a question, where something is released from its resting state into action, loud, can be dangerous"
Shoot,pull trigger on the gun
Shoot,"to kill, to injure, to go hunting, to be in the Army"
Shoot,"done with guns, bows, and other weapons, also done with cameras and video cameras, is a setting in which photography is done"
Shoot,"guns, said when you mess up, crime"
Shoot,"to fire a gun at a person or animal, to play basketball"
Shoot,"deer, gun, bow, animals, arrow, bullet, deer season, scope, basketball"
Shoot,to penetrate with a gun or something else
Shoot,"when you are upset about something that happened, not happy, regretful"
Shoot,"gun, basket ball, ockey, paintball, lazer tag"
Shoot,"to pull a trigger of a gun, to injure or kill something or someone, an action used to hunt, an action used in sport"
Shoot,"bamboo, roasting marshmallows, roasing hotdogs, greens, plants growing, trees growing, the colors brown, green, and tan"
Shoot,"shot in basketball, shoot a gun, (aiming something at a target)"
Shoot,"what you do in a basketball game to score, what you do to a gun"
Shoot,"bang, rifles, wild game seasons, basketball, protection"
Shoot,"with a gun, a star, an expression,"
Shoot,"gun, kill, wound, bullet, trigger"
Shoot,"to shoot a gun, an expression of anger"
Shoot,"as a noun can refer to a laundry shoot or mail shoot, something you drop things down as a verb refers to the killing or wounding of something with a bullet or arrow"
Shoot,"a type of plant, straight, tall, bamboo grows in shoots, hollow, thin, strong"
Shoot,"to pull the trigger, to damage, to hurt, "
Shoot,"gun, target, hunting"
Shoot,"guns, skeet and trap, hunting, video games focus around this a lot, dangerous, loud noise, smell of gun powder"
Shoot,-to kill-to hunt-violence-loud-crime
Shoot,"an expression, what you do with a gun or similar object, expression used through out some sports like basketball and soccer"
Shoot,"gun, kill, out, cops, hunting, the ball, basketball."
Shoot,"to kill, hit, or wound with a weapon"
Shoot,"Guns, to harm a something or someone, pull trigger, "
Shoot,"gun, dangerous, safety, target, orange (color)"
Shoot,"is taking away a life whether it's an animal's or another person, involves a gun, brings sadness to someone, harsh consequences"
Shoot,"guns, war, weapon, hurt, pain, blood, sadness, death, mourning"
Shoot,"gun, hunting, gang, killing, score in sports"
Shoot,when you throw something
Shoot,"something you do with a gun, to shoot a basketball, shoot bullets, "
Shoot,"guns, war, bad, basketball, sports, scores."
Shoot,"School shooting, archery, rifle, pistol, black powder, photography, profession, hobby"
Shoot,"action taken with a gun, smells like gunpowder, feels hot, sounds loud, "
Shoot,"something you say when you drop something, using a gun"
Shoot,"a branch, a vine, a thing that comes of of bamboo."
Shoot,"to fire, pull the trigger; a loud noise accompanied by the forceful expulsion of a bullet; a common substitute for the swear word Shit (which arose from British transport ships, when an item that required waterproofing would travel aboard ships, shit would be written on the side of the box for ""ship high in transit""); generally a negative connotation that indiciates frustration or disappointment."
Shoot,"a gun, a ball in a game, an arrow, used to score, used to kill"
Shoot,"baskets, gun, bow and arrow, hunting, phrase ""oh shoot"", "
Shoot,"bullets being released from a gun, a basketball player trying to make a basket"
Shoot,"Gun, used to kill, good and bad people do this, a phrase used"
Shoot,"from a gun, kill, hunt"
Shoot,bullet shot by gunviolence
Shoot,"guns, war, towards someone/something, loud noise "
Shoot,"guns, dice, gambling, murder, tunnel"
Shoot,"A phrase used by Mater in the pixar film ""Cars"". A southern American term used as an emphasis on surprise. Also what you do with a gun when the trigger is pulled or a rock when the slingshot is released."
Shoot,"animals, expression, guns, violence, hatred, anger"
Shoot,"guns, basketball, aim, bullets, targets, animals, gun range"
Shoot,"you shoot guns, you shoot for target practice, its fun to shoot"
Shoot,"camera, photo shoot, guns"
Shoot,
Shopping,"buy, purchase, have fun, market, look for"
Shopping,"spending money on items, normally in a store, can occur online, can buy food, clothes, electronics, "
Shopping,"is an action, involves lots of walking, spending money, carrying bags, get new things"
Shopping,"heartwarming, deals, bargans, sales, new clothes, new look, spending money, browsing, fitting rooms, discount, close out sale, tent sale"
Shopping,"spending money, hobby, a girls thing"
Shopping,"fashion,mall,groceries,shopping carts,shoes,credit card,books,shoes,clothes, online shopping, free shipping, coupons, girls, shops, boutiques"
Shopping,"is fun, is enjoyable, is expensive, can't be in excess, mostly done by girls, at a mall, in a store, for groceries, for clothing, for decoration"
Shopping,"the act of looking through products and purchasing some, tiring, expensive, done too much in my opinion, can be a hobby or done out of necessity"
Shopping,"spending money, buying stuff"
Shopping,"fun, can be expensive, spending time with friends, buying presents, Christmas, birthdays, ""Black Friday"", crowded, loud, "
Shopping,"is expensive, is fun, can also be inexpensive (bargain hunting), is difficult, perpetuates consumerism, keeps capitalist economies strong, promotes technology, can lead to addiction and bankruptcy, provides necessary products to people"
Shopping,"best time ever, clothes, shoes, jewelry, money, expensive, cheap, lots of walking,"
Shopping,"spending money, making purchases, searching for a desired item, the descriptive word for a cart on wheels (shopping cart), buying gifts for others"
Shopping,"fun, clothes, deals, money, time, mall, stores, girls"
Shopping,going to a mall/store and trying to find something you feel that you need or want
Shopping,"victoria secret, plato's closet, target, food, clothes, fun, smiling, laughing, goodbye money"
Shopping,"money, girls, clothes, cars, lots of people, food"
Shopping,"to spend money, to buy food, clothing, or other personal items needed or wanted"
Shopping,"going to several stores, going to a grocery store, spending money, going out with the girls, fun, trying on clothes, checking out at the register, walking, people watching, purchacing goods, shopping carts, shopping bags"
Shopping,"clothes, money, stores, friends, outfits, mall"
Shopping,"money, clothes, groceries, home shopping, anything that you buy or purchase, fun, can be boring, more appealing for women"
Shopping,"expensive, fun, new clothes, time consuming, something to do with friends"
Shopping,"mall, built by man, contains stores, people go out to shop, "
Shopping,"mall, money, purchasing of goods, store, supermarket, food, clothes"
Shopping,"expensive, clothes, games, electronics, appliances, addiction, credit cards"
Shopping,"the purchase of goods from stores, activity sometimes used as entertainment, usually associated with women"
Shopping,"buying, bartering, purchasing, done in stores, uses money, trading goods, consuming, transactions"
Shopping,"it is spending, it is expensive, it is exciting, it is purchasing"
Shopping,"money, clothes, purses, shoes"
Shopping,"girls love this, getting new things, spending money, around a lot of people"
Shopping,-purchasing-spending-money-clothing
Shopping,"enjoyed by a good portion of people while disliked by others, consists of buying items, looking for the perfect item, could be relaxing for some or hectic and stressful for others, gifts, necessities"
Shopping,"girls wants, guys dred, stuff, items, needs, wants. "
Shopping,"mall, store, spending money on something to recieve it, clothes, food"
Shopping,"searching or browsing for items, done in stores, retail, can be done online"
Shopping,"clothes, money, grocery, expensive, "
Shopping,"is a time killer, is enjoyable for women, involves spending money"
Shopping,"clothes, fun, the reason for having no money, shoes, way to spend time with friends"
Shopping,"expensive, mall , target, walmart, kohls, presents, gifts"
Shopping,when you go to the mail and spend money
Shopping,"something you do, at a mall or store, buy things, an action, something lots of girls do, is fun, can shop for food or clothes, a job, "
Shopping,"new things, expensive, shopping centers, malls, can also buy larger, important things."
Shopping,"Fun, friends, stores, clothes, online, tools, groceries, necessities, desires, money, income, business"
Shopping,"spending money, feels fun, sometimes creates debt, generally makes life better"
Shopping,"buying clothes, spending money, going to the mall"
Shopping,"is fun, is tiring, is expensive, is what you do at a store, is necessary, is how we spend money."
