Disagreement,"When two people have two differing ideas on a topic or subject, the clashing of ideas between to inquisitive minds"
Disagreement,"argue, fight, wrong, anger, red, fists,"
Disagreement,a difference in opinion. can relate to a debate between two or more people or a conflicting idea in writing. 
Disagreement,"when people dont agree, anger"
Disagreement,a dispute or an argument
Disagreement,a dispute or argument
Disagreement,to view something differently than someone else
Disagreement,"fight, argument, debate, break"
Disagreement,arguement
Disagreement,"a fight, between two parties, failure to agree"
Disagreement,"causes quarrels, don't see eye to eye,"
Disagreement,
Disagreement,when two people have different views 
Disagreement,"not seeing eye to eye when it comes to something, a misunderstanding between two people, the beginning of a fight, the cause for many friendships to be called off, anybody can have a disagreement, need to have an open mind to get through a disagreement with a resonable end."
Disagreement,"an argument, having different views on a subject than someone else which leads to an argument about said subject."
Disagreement,"a discussion of opposing beliefs, one's unwillingness to comply with another's view"
Disagreement,to not be able to agree over something
Disagreement,"to not be in concordance, angry, sadness, argumentative, "
Disagreement,"fight, argument, don't agree, different views, two or more people"
Disagreement,to have a different view than somone or something else.
Disagreement,"arguement, having a dispute"
Disagreement,"agument,fight, yelling,"
Disagreement,Not seeing the same way. 
Disagreement,"argument, reaching two different conclusions, not getting along, conflict of opinion"
Disagreement,"Argument, fight, politics, religion"
Disagreement,"perception differences, argue, difference, unbalanced, rigid, unsettling"
Disagreement,"an argument, a fight, a division, a infight, partisan"
Disagreement,"fight, dont agree, conflict"
Disagreement,"when two people dont agree on the same idea or topic, can lead to a fight or argument, opposite of an agreement"
Disagreement,not agreing with another 
Disagreement,"contract, "
Disagreement,"An argument where people have different sides in opinions or politics. Since the sides have different opinions on the subject, it ends in conflict, unless they meet half way on the conflict. "
Disagreement,"Fight, negativity, quarrelsome"
Disagreement,"can be an argument, to not agree on something, cause of an argument"
Disagreement,"argument, fight"
Disagreement,"argument, opposite ideas spoken"
Disagreement,sometimes leads to arguments. when two people do not see something the same way.
Disagreement,"is a conflict, is an argument, is a variance, is not compliant, is a difference in opinions, is a controversy, is a dispute"
Disagreement,"oral argument, not seeing eye to eye, unable to understand another's point of view"
Disagreement,
Disagreement,"not getting along with others, misunderstanding"
Disagreement,"argument, doesn't agree, difference of opinion."
Disagreement,"to not agree, have a different opinion, different views on a subject"
Disagreement,"argue, my parents, fight, hate"
Disagreement,"upsetting, argument, happen often, shouldn't get in the way of friends or family"
Disagreement,"is a problem, "
Disagreement,"anger, upset, "
Disagreement,"argument, two opinions, yelling, sometimes calm, debate class, politics, friends, family, between guys usually over sports or girls or politics, between girls usually over guys"
Disagreement,dont agree with something
Disagreement,"probably induces an argument, different sides of subject, "
Disagreement,"argue, against, fight"
Disagreement,"an dispute that may lead to conflict, when two people disagree they have different outlooks on things"
Disagreement,"problem, argument, conflict"
Disagreement,"argue, fight, anger, saying things you don't mean, upset, compromise"
Disagreement,"to not agree, be in an argument, thinking someone else is wrong and you're right"
Disagreement,"argument, fighting, being wrong, "
Disagreement,"is opposing views, opposite of agreement"
Disagreement,"animal characteristic, verbal or physical, seen throughout time"
Disagreement,When you do not believe in someones opinion. Disagreement is usually what causes an arguement.
Disagreement,"Non-negotiable, crossroads, argument"
Disagreement,"not agreeing on the same idea or term, argument, fight, verbal fight, or physical"
Disagreement,A lack of not agreeing with an individual.
Disagreement,
Disagreement,"argument, fight, do not agree on the same thing"
Even,"A number that is a multiple of 2, opposite of an odd number. "
Even,"opposite of odd, the same thing given to everyone, 2,4,6, numbers,"
Even,"odd, equal, the number two, the same"
Even,"number, odd, steven, math, multiplication, addition, subtraction, score, link, tie, equal, same, level"
Even,"Numbers, fair, "
Even,"Matched, neck and neck, straight, not crooked, equal in quantity or quality"
Even,"Odd, numbers, smooth, level, uniform"
Even,can be a mathmatical term. also used synonymously with fair. 
Even,"numbers such as 2,4,6, balanced, not odd"
Even,in line or organized. in order
Even,organized. in order
Even,"to divide something symmetrically, so that each person get the exact same amount "
Even,"alike, math, balanced,level, matching"
Even,not oddgetting backfair
Even,"flat surface, no obstacles, an equal state, being fair, being divisible by the number 2 "
Even,"describes numbers, balance,"
Even,
Even,equal
Even,"any number that ends in a 0,2,4,6, or 8, a level surface, when things are balanced, useful when it comes to scales, fair situations, when two people are the same at some skill."
Even,"something that is fair, the same amount as something else, "
Even,"is fair, is not crooked or lopsided"
Even,"equal, when two things are measured to be the same"
Even,in equivalence with something else
Even,"steven, equals, math, numbers, making my bed, counting"
Even,"not odd. refers to numbers. 2,4,6, ec... refers to surface level"
Even,"2, 4, 6, 8, when you want reveng you get this, "
Even,"math, equal, balanced, same "
Even,"fair, equal, at the same pace"
Even,"equal, the same, fair"
Even,"Not odd, Evan, math, numbers, Steven, Even Stevens"
Even,"balance, numbers, not lonely, straight, matching, pattern, life"
Even,"level, fair, "
Even,"equal, same, sharing"
Even,"opposite of an odd number, a balanced state, level, flat, opposite of a slant"
Even,same on both sides 
Even,"type of number, "
Even,"The opposite of odd, settling old disputes, revenge, A number divisible by two."
Even,"Number, amount "
Even,"to be good, clear and square with someone, to be level."
Even,"number, same, paid up"
Even,"flat, opposite of odd"
Even,not tipped to one side. equally balanced.
Even,"is fair, is not odd, is level, is parallel, is uniform, is nonfluctuating,  is not easily excited, is identical, has an equal probability"
Even,equal
Even,
Even,"getting even, parking even, blood sugar even, blood pressure even,"
Even,"numbers, getting even with someone."
Even,"to be proportionate, to be square, when all sides are the same"
Even,"equal, water depth, "
Even,"not odd,in line with something else"
Even,"is equal, is level"
Even,"getting even, even numbers, fair."
Even,"equal, makes two people usually happy, split, not odd, compromise"
Even,"same, comparison"
Even,"same amount, fair, tie, race term often used"
Even,"opposite of odd numbers, organiozation"
Even,"the opposite of odd,2,4,6,8,etc.  always divisible by the number two"
Even,"same, equal, fair"
Even,"same, tie, no winner, no loser"
Even,"can be a number, parallel to an object"
Even,"numbers, not odd, same amount, not greater or less than"
Even,"Opposite of odd, 2, 4, 6, 8, etc."
Even,"Fair, Equal, parallel "
Even,"Even is a word to describe certain numbers. It is the opposite of odd numbers. 2,4,6,8 are all even numbers."
Even,"the same, equally matched"
Even,"equal on both sides, shared, fair, even sides"
Even,When both teams fail to beat one another. 
Even,
Even,"math, numbers, on the same level"
Forward,opposite of backwards. 
Forward,"to go straight, no going back, to move in one direction, onward, foward march."
Forward,"motion, driving, running, moving, backwards, sideways, email, not looking back"
Forward,"introduction, horny, direct, backwards, car, movement, motion, falling, "
Forward,"Front, "
Forward,"Continuing, not looking back, a direction, an optimistic denial of defeat"
Forward,"Straight, clear, ahead, decisive, front, distance, run"
Forward,position in football. direction of movement. 
Forward,"to move ahead, can be used with emails, "
Forward,moving any way the front side of your body is facing
Forward,to move in the direction you face
Forward,to move on. to keep going 
Forward,"ahead, leading, pay it forward, making progress"
Forward,ahead infrontmovement
Forward,"moving ahead in a particular direction, moving onward, more advanced"
Forward,"motion, most animals walk forward, in a classroom you face forward, "
Forward,
Forward,ahead
Forward,"the person who usually scores in a soccer game, the tall strong guy on a basketball team, being blunt and to the point with someone about a certain subject, moving ahead of where you are, a command, used by officers and people in charge to tell people where to go."
Forward,"to move on away from something in the past, looking ahead and moving in that direction"
Forward,"not backward, to face the teacher or a goal head-on, to be thinking ahead "
Forward,moving in the direction in front or facing towards
Forward,the direction in front of a subject
Forward,"backward, moving, moving on, a goal"
Forward,action. to move. to look/see. 
Forward,"to move, not go backwards, "
Forward,"text,car, truck ,phone,many poeple see"
Forward,"progression, positive actions,  positive results, going somewhere "
Forward,"a direction, moving from point A to  point B"
Forward,"Backwards, sideways, up, down, email, texts, arrows"
Forward,"step, ahead, positive, future, continuation, move"
Forward,"is progress, is assertive, "
Forward,"closer, destination, progress"
Forward,"the opposite of backwards, you can use this when referring to driving or walking"
Forward,moving in a positive direction
Forward,"rewind, play, pause, in front of, "
Forward,"The beginning of a work of fiction. The forward usually gives the reader a hint of what the story is going to be about, it is usually a page long, or a paragraph, but can be a simple sentence or two.  Also a forward could be used at the beginning of a CD to set the whole mood of the CD. "
Forward,"Front, march"
Forward,"To progress, to move straight in front of you, the direction you want to go in life, the way towards a goal. "
Forward,"progress, going"
Forward,"ahead, straight, opposite of backward"
Forward,looking towards the future. not looking back on things.
Forward,"in front, to move ahead"
Forward,to move ahead
Forward,
Forward,"fast forward, forward in sports, going forward in life"
Forward,"opposite of backwards, everyone goes forward. "
Forward,"to send a text to another person, to push something further"
Forward,"keep looking forward, moving, not back, in front"
Forward,"in front, ahead, blunt"
Forward,"is ahead, is an email or text message"
Forward,"pay it forward, go straight, continue, keep going."
Forward,"big basketball player, advancing in position, war shout, movement, lines, "
Forward,"walk, direction"
Forward,"move along, positions in sports, green arrow"
Forward,"ahead, going in front, moving"
Forward,"continuing straight, the opposite of backwards"
Forward,"face first, positive, moving on"
Forward,"to advance, moving, right direction, no looking back,going fast, proud of yourself, sense of relief"
Forward,moving toward something or away 
Forward,"back future remotes, dvr, dvd, vcr, running, moving, growing up, "
Forward,is opposite of backward
Forward,"The front, first in line, before the others."
Forward,Forward is a step in the right direction. When you move ahead. Forward is advancement and many other things.
Forward,A beginning of a book
Forward,"in the future, fast forward button on a tape or video, a physical representation of something not here but farther in the distance"
Forward,Someone who main purpose in hockey is to score
Forward,
Forward,"to look into the future, to send to someone else, a type of direction"
Horn,an instrument blown into to make music or a sharp part on certain animals heads. 
Horn,"loud, on cows, a ritual, warning sound, many different syles of horns, music, gold, cars"
Horn,"car, loud, annoying, some people hit it when they have road rage, sporting events"
Horn,"Deer, cow, musical instrument, Rhino, dinosaur"
Horn,"Trumpet, loud, brass, tuba, trombone"
Horn,"Loud sounds, ringing out, brass instrument to produce a blaring sound, an instrument for expressing musical feelings"
Horn,"loud, car, bronze, round, oval, rhino, "
Horn,is a musical instrument. is made of brass and played by the mouth. 
Horn,"can be of an animal, could be a sound device, could make noise, could be use as a weapon"
Horn,a loud sound object
Horn,a loud object
Horn,"a cone shaped protuberance that is usually found on fawn, goat, and bovine animal. It can be used for defence"
Horn,"car, bull, bike, clown, beep beep, honk honk"
Horn,found in a carfound in a band (french horn)makes noise 
Horn,"usually found on male animals, an instrument used to make noise, hard"
Horn,"made of bone, found the heads of some animals (ie: cows, bighorn sheep)"
Horn,
Horn,"loud, exciting, sometimes angry"
Horn,"one of the loudest parts of a car, honking it, a geographic location, a mountain name, the sharp part of a few animal species, made from air moving through a tight spot, is an instrument, made from bone or teeth, can be both hard or soft, played by musicians, used as a defense mechanism."
Horn,"a means to make noise, attached to cars and bicycles to announce presence when necessary"
Horn,"is in a car, is on a bike, is an instrument, is used to signal a warning"
Horn,"sharp, hard, pointy growth that is part of some animals. example=elephants and rhinos"
Horn,"instrument, many types: french, english, ect., brass instrument, shiny, loud"
Horn,"loud, obnoxious, startling, clowns, trains, cars, bikes, safety precaution "
Horn,a hard growth on an animal. a car has one. 
Horn,"long and has a point on the end, hard, found on a unicorn, "
Horn,"car,alert,loud,annoying"
Horn,Makes loud noises.  Used to get attention.  Drivers use horns to get other drivers attention.  Trains use horns to warn of crossing.   It's an instrument.  In the brass section.
Horn,"musical instrument, can refer to an animal's appendages, alarm device"
Horn,"Car, bike, loud"
Horn,"Band, car, gold, brass, loud, long, tone, annoying"
Horn,"loud, vibrant, cows, pointy"
Horn,"honking, cows, cars, sharp"
Horn,"found on sheep and cattle, can be used in times of danger or anger in a car, loud noise to get a persons attention"
Horn,loud nose giving awereness.
Horn,"band, trumpet, car, "
Horn,"used in cars as an alerter for a emergency, most drivers use it as a sign of displeasure for another driver. Several animals have horns either as ways to display dominance over other males, or to attract females. "
Horn,"Pointy, unicorn, bull"
Horn,"you blow into it to make noise, can be different shapes, sizes or colors, used in old times to warn civilization of an incoming enemy"
Horn,"animals with them, sharp, hard"
Horn,an cautionary or alerting sound
Horn,like a trumpet. musical instrument. used for music.
Horn,"is made of bone, is hallow, is on the nose of a rhinoceros, is on the head of a cow, is the pommel of a saddle, was an instrument used in the hunt"
Horn,"noise maker, loud, gets attention, noticeable, hard to ignore, annoying"
Horn,
Horn,"brass horns, car horn, fog horn, "
Horn,"blow into, on top of animals. "
Horn,"something on your car, something on your bike, something to warn other cars that you're there"
Horn,"bull, cylinder, sharp, grey black, toe nail matterial"
Horn,"trumpet, tuba, brass, loud"
Horn,"is a musical instrument, is on a unicorn"
Horn,"loud, obnoxious, traffic, rude, French, band, car."
Horn,"instrument, bull's head, sharp, loud, angels, texas, music, vikings"
Horn,"loud, attention "
Horn,"in a car, loud, alarming, used to get attention"
Horn,"animal, blow horn"
Horn,"an instrument, played by mouth, usually included in a band or orchestra"
Horn,"car, sporting event, boat"
Horn,"loud, obnoxious, warning, brings something to attention"
Horn,"sticks up, maybe pokes, on the head of certain animals"
Horn,"cars, games, halftime"
Horn,"Is a part of a car, makes a loud noise, can also be a part of an animal's body"
Horn,"Loud, viking, used by humans, brass color, can be an instrument"
Horn,Horn is something on an animals head. Animals such as a ram has horns on their head.
Horn,"Instrument, brass, circular, power, beauty, majesty."
Horn,"horn can be a bone obtrusion from an animal, or an instrument, such as the french horn, around the horn baseball term for throwing the ball around the infield"
Horn,"A curved and pointed body part that is found on cattle, sheep and goats."
Horn,
Horn,"car horn, noise, instruments"
Inferior,opposite of superior. to be less than someone or something
Inferior,"to feel lower then, depressed, saden, unable to do anythings, no voice or your own"
Inferior,"smaller, not as good as something else, cowering down to something, superior, "
Inferior,"below, men, women, children, mudbloods, cows, mice, bugs, poor, politicians, ignorant people, assholes"
Inferior,"Small, less than, not as important, miniscule, "
Inferior,"Degradable, temporary, less in quality, way to describe someone to look down on"
Inferior,"lesser, smaller, weak, infant, mediocre, poor"
Inferior,not up to standards expected by someone. not adequate or useful. 
Inferior,"less than, "
Inferior,is below. underachieved. lesser.
Inferior,below. underachieved
Inferior,to feel look down upon by someone
Inferior,"less,smaller,lower,bottom"
Inferior,below not as good 
Inferior,"bad, depressing, poor quality"
Inferior,"describes importance or value, less than, "
Inferior,
Inferior,applies to quality of objects
Inferior,"weaker, smaller, dumber, not as good when compared to something of better quality, opposite of superior, can refer to a loser of something."
Inferior,"less than something else, not good enough to be associated with something"
Inferior,"to be less than, not as good as something/someone else"
Inferior,"being less than, or insufficient"
Inferior,lesser in some way than others
Inferior,"Small, weak, less than something, not important, looked down upon, treated badly"
Inferior,Refers to a feeling of superiority. 
Inferior,"lower in place, or position, close to the bottom, poor quality"
Inferior,"wimp, not leader, submissive, "
Inferior,"Lower than some one else, like in a class based system, peasants are inferior to kings and queens  "
Inferior,"less than something else, lower quality, looked down on"
Inferior,"Low class, not wanted, submissive"
Inferior,"not good enough, less than others, not worth effort, unsatisfactory"
Inferior,"poorly made, is less valuable"
Inferior,"over the top, the best "
Inferior,"something that is close to the bottom or base, a lower ranking or degree, something that is less important, a lower ranking"
Inferior,"The worst choice, something you dont want."
Inferior,"superior, is lower than something, "
Inferior,"Something not up to standards set upon it, usually the underdog, in racism it can be used to describe a culture that group of people hate, is the spark of genocide, outdated technology. "
Inferior,"Insecure, lowly, low self-esteem"
Inferior,"to be lower than somebody in status, rank or quality."
Inferior,"lower, easy to control, unintelligent, weak"
Inferior,something of less importance
Inferior,not held as high as something or someone else. perceived as less.
Inferior,"is lower in standing, is beneath something, is of poor quality, is mediocre, is less powerful"
Inferior,"less than, not as good as, not desirable, imperfect"
Inferior,
Inferior,"animals or humans being territorial, not trusting or believing someone, having a lack of confidence "
Inferior,"lower in station, less improtant."
Inferior,"less important, second to, not relevant"
Inferior,"discuss, unable to look at, idiotic"
Inferior,"below something or someone else, subjected"
Inferior,"is low, is not as good,"
Inferior,"low self esteem, unhappy, rude, nobody should feel this way, superiority complex, bad, not cool, Hitler, Jews."
Inferior,"not good enough, others are superior, striving to become superior, looked down on sometines, not as successful"
Inferior,
Inferior,"lesser than, loser, not as capable, "
Inferior,"less than, unequal to"
Inferior,"not good enough, no matter what happens, everything will be worse than something, the worst outcome always happens"
Inferior,"weak, less, not equal"
Inferior,"less than, not as good as, lowly, lame"
Inferior,smaller than
Inferior,"slave, peasant, "
Inferior,"is opposite of superior, can be a bad thing"
Inferior,"Underneath, belittled, discriminated, hurtful, used by animals"
Inferior,"the definition that comes to mind is, ""not as good as."" other than that I do not know how to explain it."
Inferior,"Lesser than, unequal, lacking strength."
Inferior,"not satisfactory, inability to succeed at a task that is asked, old model of something newly made"
Inferior,Someone who believes they are more important than everyone else.
Inferior,
Inferior,"not as powerful, works below people, does not have as much say/opinion"
Iron,"Element on the periodic table (Fe), a device used to smooth wrinkles out of clothes"
Iron,"man, strong still, pennies, pill taken for vitiams, chalky taste, in the blood, burise easy if you dont have enough, bridges, bulidings"
Iron,"iron maiden, metal, steel, cold, hard, machine"
Iron,"Iron man, weights, maiden, fist, car, heart, vitamin, blood, curling, lung, deficiency, penis, sex, straightening, Robert downey Junior, clothing iron, wall"
Iron,"Metal, Fe, ion, element, steel, "
Iron,"A vitamin, a metal, hard, cold, a state of mind"
Iron,"Steel, hard, metal, clothing, heat, steam"
Iron,is a household appliance. used to remove wrinkles from clothing and linens. uses heat and steam to flatten and smooth fabric.
Iron,"metal, can also be a flattening tool, used to make many appliances in days of old"
Iron,a type of metal
Iron,a type of metal
Iron,metal made from steel and coal. it is a natural metal that most people need in there diet
Iron,"Fe, steel,heavy, thick, metal"
Iron,used for closecan be hotits a metal
Iron,"hard, usually grey colour, building material, essential for health, present in blood, "
Iron,"used to make steel, chemical element, Fe, has 26 protons and neutrons, hard, crystalline structure, "
Iron,
Iron,"strong, hard, grey"
Iron,"metal, dull, had its own age in Europe and Asia, worth little money, manipulated by smiths, makes weapons and armor, can cause sickness, a lack of it in a person causes anemia."
Iron,"a metal, needed to live, blood contains it, you get it from food, you can build with it"
Iron,"is an element, is magnetic, is found in cereal, is gray/black, is sturdy and strong, is metal, a lack of which causes anemia"
Iron,a metal element that is mined for its rigidity and is made into many different objects
Iron,"element, metal, hard, strong, used in machinary, factories, many appliances, vehicles, "
Iron,"hot, smooths things, metal, contains starch, fixes clothing, can ruin clothing, burns, dangerous, not for children, do it on a table."
Iron,metal. element
Iron,"used to straighten out clothes, a mineral in the periodic table, "
Iron,"somthing in blood, hard, steel"
Iron,"Used to straiten clothes, electric, requires water, requires an ironing board"
Iron,"tough metal, element, strong and sturdy, mineral to help hemoglobin production, hot device to take wrinkles out of fabric, golf club, used to identify livestock"
Iron,"Clothes, Board"
Iron,"hot, metal, resource, common, useful"
Iron,"element, is needed to live, is strong, is a metal, is malleable "
Iron,"a type of metal, or to press clothes "
Iron,"releases heat, makes your wrinkly clothes unwrinkled, some contain water, puts off steam, used on a board or a hard surface "
Iron,a substance that is used to build many things
Iron,"clothes, metal, "
Iron,"anemia, a hard meldable element, blood, used in armor, machinery, vehicles, guns. "
Iron,"Metal, heavy, silver"
Iron,"strong,hard, magnetic, silvery-gray metal, chemical element "
Iron,"strong, unbreakable, hard"
Iron,a vital industry in the united states
Iron,object used to get rid of wrinkles from clothing. usually involves an ironing board. 
Iron,"is a metal, is heavy, can rust, is an alloy, is a periodic element, is, an appliance, presses clothes, is used in tools, is used in weapons"
Iron,"appliance, applies heat to clothes, removed wrinkles, hot, steam, dangerous"
Iron,
Iron,"Iron worker, curling iron, flat iron, iron to iron clothes, iron pills"
Iron,"striaghtens something, no more wrinkles."
Iron,"used for smoothing out wrinkles, levels in your blood, necessary vitamin, used to straighten hair"
Iron,"clothes, skillet, christopher walken, metal, iron worker, iron hide"
Iron,"hot, straightens clothes, household tool, electrical"
Iron,"is strong, is a building material "
Iron,"steel, buildings, industrial revolution, strong, shiny, everywehere."
Iron,"Fe, an element, very strong as a big piece of metal, used in cooking utensals, blood, vitamins, "
Iron,straightens clothes
Iron,"element, hard, silver, used in mechanics"
Iron,metal
Iron,"a metal, used to build a lot of things, rusts when it is wet, humans have iron in their bodies, iron is magnetic"
Iron,"metal, hard, rough, vitamins, "
Iron,"hot, no wrinkles, different kinds, used on clothes"
Iron,"can be in blood, nutrient"
