Glory,"pride, honor, adoration, a very desirable quality, associated with achievement or majesty"
Glory,"Blades of Glory the movie, good feeling after achieving something, Morning Glory the flower, morning glory the expression used when someone is not a morning person, something that can only be achieved if one has passion for something"
Glory,"God, honor, power, justice, freedom, prosperity, pure, something to be reached for, a tool in persuasion, animals, good"
Glory,"flag, god, "
Glory,"A form of praise that comes from sports, war, high academic achievement. "
Glory,"victory, long lasting good feeling, praise and honor."
Glory,feeling of happiness
Glory,"victory, winning, legacy, a personal goal, admire by others"
Glory,"feeling accomplished, overcoming a obstical, something that is looked up upon, something holy."
Glory,"american history, the bible, church, jesus, songs"
Glory,"is a brand of jeans called ""faded glory"", is a positive word, in america usually used in referring to the flag or american pride, can refer to situations, objects, or people, is a describing word"
Glory,"people strive for it, can unite a nation of people"
Glory,"happiness, success, winning"
Glory,"is beautiful, magnificent. important."
Glory,"aquiring fame, a feeling, feels good"
Glory,"a feeling, united states, freedom, pride"
Glory,"fame, honor"
Glory,is to be achieved
Glory,"praise, soldiers, notable accomplishments, heros, it is sometimes fought over, cherished by some"
Glory,"victory, praise, proud, accomplished, noticed, respect."
Glory,"winning, victory, exciting"
Glory,"victory, win"
Glory,"is earned, history, heroes, stories, greatness, legions"
Glory,"Honor and power, God, the color gold, achievements, pride, glorify, rejoice"
Glory,God
Glory,i don't think of glory as a noun
Glory,pride
Glory,american flag
Glory,"winning, maybe taking things to the extreme to attain, getting what you have worked so hard for"
Glory,"glorious, exciting, exalting, high-up, recognition"
Glory,american flag; patriotism; winning; pride; war
Glory,"what most people look for when they do certain tasks, i.e. sports teams winning something, a person at work doing a big project expecting a promotion"
Glory,"praise, happiness"
Glory,"associate with God and religion, also associate with athletic sporting events, fame and ""glory"""
Glory,"is acheived in war, obtained through winning, is exciting, is honorable, is a product of hard work, is not easy to come by, is respectable"
Glory,"to God, name of an old person, something to cherish"
Glory,"great praise or honor given to someone or something, fame, admiration"
Glory,"God, the Lord, often in religion, amazing, piety, "
Glory,the feeling of accomplishing something and being recognized for your accomplishments 
Glory,
Glory,
Glory,
Glory,"make up snow, are white, melts into water, associated with winter"
Great,"is good, is excitement"
Great,"The best, good, better than the rest"
Great,"is something very good, positive"
Great,"sports, outside, family, friends, relaxing, swimming, boats, waverunners, rivers, camping"
Great,"a feeling, accomplishment, a leader, looked up to"
Great,"large amount, bigexceptional, wonderful, excellent"
Great,better than good or above average
Great,"something you like, your interested in, amazing, having fun, "
Great,"fantastic, wonderful, nice"
Great,"distinguished, imminent, having power"
Great,"sales, value, gatsby, bambino"
Great,"good job, can be a lot of items, "
Great,"Alexander the great, well done"
Great,"good job, congratulations, Alexander the Great, well done"
Great,"a describing word. used during exciting situtations. used in the place of wonderful, awesome. "
Great,"a positive word, good, could also be used in place of the word ""large"", "
Great,"is an adjective, is descriptive, successful, awesome, wonderful, fabulous, outstanding, awe inspiring, Alexander the Great, Rome"
Great,"Beyond good, expression of enthusiasm, showing of large qautity"
Great,"job, lakes, effort"
Great,"excellent, good grades, fantastic, wonderful, what teachers tell you, what your parents tell you, what coaches tell you, makes you feel good, positive reinforcement, positive feedback, puts one in a better mood, makes you do better, opposite of criticism, "
Great,"good, big, better than something else"
Great,"increadible, large, something good or pleasant, awe inspiring, fantastic"
Great,"amazing, above the rest"
Great,"day, person, dog, cat, family, friend, neighbor, lover, class, book, tv show"
Great,"Great is an adjective, describing someone's qualities as very good, or better than most. It implies a sense of success, as well as bigness and awesomeness. Things that are great seem to go beyond the normal range of human achievement."
Great,"feels good, broad term, over used, describes, compliments, "
Great,"outstanding, successful"
Great,"adjective, wonderful, amazing, somebody or something that brings pleasure, superior"
Great,"impressive, more than good, admirable, large, powerful, "
Great,"the best, Alexander the Great, winning, something that exceeds any other of its kind by a far shot, something that is larger than something else such as a number 8<3"
Great,"good, powerful, prosperous, effective, not a noun"
Great,"powerful, fantastic, good work, success"
Great,"Fantastic, wonderful, something that one would find emotionally or physically stimulating."
Great,"used when someone is happy, or if someone has done a good job."
Great,"better than good, less than wonderful"
Great,"the best, winner, amazing, "
Great,"something that is better than expected, makes you happy, better than the ordinary."
Great,"success, rewarding, my great grandfather, a happy time"
Great,"associated with good, associated with fantastic, associated with terrific, could be a feeling, could also be used for describing an object or situation, a positive word"
Great,"is a term to describe something that is really good, people strive to achieve this in many things"
Great,"something to say about how you feel, lovely, leader figures if they do a good job"
Great,is a lot of different things. food is great. people are great. 
Great,"feels good, confidence, good work"
Great,"feeling, good, awesome, an act"
Great,"dane, mighty"
Great,is me
Great,"pleasant, happy, well-skilled, a ""good"" athlete, liked"
Great,"an adjective used when something was really enjoyed, accomplishment, achieved, honored."
Great,"is good, wonderful, positive, happy"
Great,"superior, better than good"
Great,"is amazing, talented, delicious, well known"
Great,"Awesome, A great person, sarcasm, adjective, slogan for frosted flakes, good, opposite of  bad"
Great,my bed
Great,i don't think of great as a noun
Great,excellent
Great,job
Great,"fantastic, getting what you want and feeling good about it, amazing, God, "
Great,"awesome, good, exciting, not bad, not boring "
Great,to be exceptional; to do extremely well on something such as a game or test; 
Great,something that has exceeded good. could positively affect someones day or future experiences
Great,good
Great,"adjective - wonderful, large - used in describing emotion or physical size"
Great,"is beneficial, is a large amount, is well done, is awesome, is fantastic"
Great,"something that's really awesome, can't get enough of it, not a material good, it's a feeling, is an opinion, has different meanings for different people"
Great,an object that is very large or has a lot of significance
Great,"Alexander the great, big, important, amazing, awesome, useful, helpful"
Great,"amazing at something, better than someone else "
Great,
Great,
Great,
Great,"child-like, worthless, trash"
Leader,"is in charge, makes decisions for a group of people, puts other before themselves"
Leader,"president, commander, takes control"
Leader,"somone who guides, a person of authority and respect, has lots of responsibility, is regarded as a role model"
Leader,"ghandi, malcom X, Martain Luther Kind Jr., inspires others, "
Leader,"follower, organized, inspirational, motivator, kind, willing to be wrong"
Leader,"someone in control, a role model, a good example setter"
Leader,"is confident, organized, opinionated, strong, a good listener, makes fair decisions, can talk to people easily "
Leader,"in charge, followers, respect, control, passionate, executive postion, "
Leader,"Obama, president, teacher, church, controler "
Leader,"high rank, leads a group, has good qualities, helps followers"
Leader,"strong, leads, accountable"
Leader,"Our president, the dean, someone who is in charge"
Leader,"president, in charge"
Leader,"president, person in charge, not a follower, successful"
Leader,"Someone in the front of a group. The one who steps up and gives his/her own opinions. The president, The senator, The governer. Your boss. "
Leader,"is a strong individual, has good morals, leads by a good example, looked up to by people, has a positive attitude, nice, caring, "
Leader,"leadership, president, teacher, husband, boss, "
Leader,"Someone who takes charge, qualities of them usually make people want to listen and follow, must be responsible and get work done, depended on by others"
Leader,"president, in charge, bossy"
Leader,"lead followers, important, one everyone listens to, loud, proud, positive, must be confident, find them on sport teams, in the military, in the classroom, in clubs and organizations, you can look up to that person"
Leader,"also a follower, strong, outgoing, respected"
Leader,"someone who displays traits that are desirable to a large number of people, can be good or evil, is admired, is feared, "
Leader,"Someone who stands out, courageous, brave"
Leader,"president, power, organization, guide"
Leader,"A leader is one who sets an example for and directs the actions of others. Officers in the military are leaders, as are teachers, politicians, and other officials."
Leader,"has followers, usually has some kind of purpose, sets the standards for others, shows the way for others, has confidence, should stay humble."
Leader,"strong, smart"
Leader,"someone that guides, president is an example, level headed, calm, passionate, compassionate"
Leader,"in-charge, responsible, honest, decisive, trustworthy, admirable, "
Leader,"someone who can take charge in a group of people, a leader is looked up to, a leader is hated, a leader is loved, a leader is anyone who can set an example, anyone who has strong values, anyone who is a strong individual who stands up for what they believe, a team captain, a president"
Leader,"Charismatic, intelligent, powerful, effective, potent, a good speaker, a problem solver, healthy, strong, forceful, diplomatic, should not be weak, strong moral values, should look out for her flock, "
Leader,"in charge, comanding, hard working, responsibillity"
Leader,A person to whom others look towards for guidance. A high moral figure in society.
Leader,"The first person, gives orders, makes decisons, like the president."
Leader,"ahead, powerful, someone who is looked up to"
Leader,"a person, inspirator, not afraid, does the right thing, virtue, good, honest, "
Leader,"someone who is in comtrol, someone who has followers, makes decisions, used in a group, is understanding of other peoples thoughts and wants."
Leader,"smart, controlling, organized, the president, ""follow the leader"", are loud"
Leader,"associated with ""boss"", means someone is in charge, is a positive word, used to describe a person"
Leader,"leads groups of people, outgoing, good at communication, fearless"
Leader,"president, authority figure, takes control of situation, people follow this person, important"
Leader,"is a person, is important, is daring, and willing. Examples include president, vice president. "
Leader,"some one who is looked up to, knows what to do in situations, strong, smart, tusting, charismatic"
Leader,in charge
Leader,"president, controler"
Leader,"is exceptional, is brave, is honorable"
Leader,"role model, experienced, well-liked, a people person, takes charge, quick thinker, quick decision maker, keeps order, creative"
Leader,"is someone who is usually respect, leads a group of people (followers), guides people, responsible, intelligent, honorable, sometimes deceiving."
Leader,"confident, strong, reliable, teachers, parents, president, principals, rules, has followers"
Leader,"somebody like a king, or president, takes control, has followers"
Leader,"is dependable, hero, great, teacher, mentor, wise, motivates, entertains, leads, describes, divides"
Leader,"Has many followers, should be respectful, some leaders can be cruel, to lead a line, follow the leader, the president, someone who is in charge, leadership"
Leader,captain
Leader,"President, directs a group, above everyone else, power, pack"
Leader,boss
Leader,strong
Leader,"role model, someone who can take charge, isn't afraid, confident, does what is right, helps others"
Leader,"someone who takes control, president, teacher, someone who sets a good example to be followed, follow the leader, line leader "
Leader,the president; a teacher; the team captian; the coach; congressmen; governor; mayor; someone who makes decisions and others follow; 
Leader,"looked up to by others, most times elected or chosen, has many good qualities like listening skills and communication"
Leader,"leadership, in charge, bossy, smart, courageous, intelligent, brave."
Leader,Some one who is in a position of power and decision making ability over a group or organization
Leader,"is in charge, gives out instructions, follow this person, answers questions"
Leader,"followers follow the leader, person in charge, makes decisions, leads people to victory, looks out for the best interest of their followers"
Leader,a person that leads a group of other people
Leader,"encompassed by followers, stands tall, above the rest, organizes, gets the plans together"
Leader,"head honcho, always in charge"
Leader,
Leader,
Leader,
Leader,to use as little time as possible 
Massage,"is sometimes hart breaking or exciting, and sometimes be miss-interpreted, is written, is typed, is verbal"
Massage,"relaxing, releaseIng of stress, sensual"
Massage,"relaxing, rejuvenating, touch, soothing music plays, takes place in dark rooms, reduces tension in muscles"
Massage,"amazing feeling, hands on, romantic, sexual, pleasureful, love when sarah gives me one"
Massage,"calming, relaxing, found in a salon, back rub, fully body"
Massage,"rubbing the body, relaxing, eases pain"
Massage,"is something people do for relaxation, loosens muscles and relieves toxins, can be expensive"
Massage,"relaxing, feels good, feel loose, sleepy, deep tissue, "
Massage,"text, "
Massage,"soothing, relaxing, hands rubbing, kneading, relieves pain, bare skin, gets rid of tension, couples"
Massage,"feels good, asian, happy ending, oil, naked on board"
Massage,"is soothing, is calming,"
Massage,"feels good, involves two people"
Massage,"chinese, relaxing, expensive"
Massage,"stress reliever. uses pressure on the body by hands. given by a masseur. can be done professionally, or by an ameteur."
Massage,"is a rubbing of muscles, causes relaxtion and one to feel better, a kind of therapy."
Massage,"thearpuetic, massage therapist, back rub, laying down, feels good, expensive"
Massage,"Rubbing of one's body, used for relaxation and relieving stress"
Massage,"relaxing, tight muscles, hot rocks"
Massage,"relaxing, chiropractic facilities, soothing, good hands, warms hands, heat, pressure, calm you, long time, wants to sleep afterwards, makes you dehydrated, drink water after them, quiet places, soft slow music playing during, no talking, whole body, different kinds,"
Massage,"relaxation, comfort, bliss, feels good"
Massage,"plesant experience, relaxing, relaxes muscles, relieves stress, can be done to your head, back, neck, feet"
Massage,"feels good, relaxing, soothing, enjoyable, people do this, career"
Massage,"professional, assistant, hands, oil"
Massage,"A massage is a rhythmic rubbing of the muscles in your body, usually your back or neck. It helps relieve tension and soreness, and is a calming experience. Massages are commonly offered at spas or salons by therapists."
Massage,"awesome, relaxing, hurts your thumbs, releases toxins, feels good, gets rid of muscle pain, sensual, preformed with oils, calming, happiness, euphoric "
Massage,"therapist, deep tissue massage, parlor, "
Massage,"relaxing, provides relief, comfort, often performed on the back, neck or shoulders, can be performed on feet, therapeutic, aromas can be used with it"
Massage,"applied pressure to certain body parts to alleviate pains, common part of physical rehabilitation, relaxing, many different techniques, expensive, occasionally medically necessary, relieves stress, good for you"
Massage,"therapist, makes something feel better, rubbing something to make it better, usualy massage muscles, relaxing, helps relieve stress, can be therapuetic, can be taken with sexual references"
Massage,"Enjoyable to give, softer touch in some places is more appropriate, very relaxing, can be shoulders, neck, back or full body"
Massage,"relaxing, stress releif, body,"
Massage,A massage is a form of contact between one person to another. Usually meant to give relief for minor aches and pains or for general relaxation. A massage may also be self-administered. (Ex. Massage for own foot)
Massage,"To relax the muscels, helps sooth."
Massage,relaxing
Massage,"relax, good feeling, "
Massage,"relaxing, puts you to sleep, done in a quite place, soothing music, something that makes you feel better whe you are done."
Massage,"relaxation, the spa, my mom, stress reliever, nu essence"
Massage,"associated with rubbing down of the body, is a positive word, makes people happy, people look forward to this word,  can be an incentive word"
Massage,"relieves tension in muscles, is very relaxing, desired by many people"
Massage,"can be expensive, relaxing, feel really good, enjoying"
Massage,is relaxing. is good when you're hurt. is expensive. 
Massage,"relaxing, therapist, releaves stress and pain, done by misuse,done at a spa, done with hands"
Massage,"job, used for stress, feels good, relaxing"
Massage,"parlor, tissue"
Massage,"is relaxing, is energizing"
Massage,"relaxing, comfort, masseuse, back, muscles, oils, stress reliever, pampering one's self, "
Massage,"is an action, can be done almost anywhere on a body or object, usually are to relieve pain or pressure, feel good, can be a profession, used for pleasure."
Massage,"rubbing of the skin, strong hands, feels good, rejuvenation, relaxation, expensive "
Massage,relieves stress 
Massage,"rubbing the body, feels good, profession, oils, sexual, healthy, hard, soft"
Massage,"relaxing, spa, relieve tension, done with hands, massage chairs, while getting a pedicure you sit in a message chair, massage therapy"
Massage,bed
Massage,"Something that I can get done at the mall, makes my muscles feel better, relaxes, back, feet, hands, legs"
Massage,relax
Massage,relax
Massage,"feels good on tight muscles, intimate, profession, "
Massage,"feels good, hands, lotion, gets knots out, relieves stress, expensive, at a salon"
Massage,be relaxed; to relieve stress; loosen up a tight muscle
Massage,a person usually gives this to another person by rubbing the muscles. could be done professionally by a stranger or by a loved one. 
Massage,"relaxing, quiet, soft, aroma, tense, muscles"
Massage,"rub to relieve stress or tired muscles, hand massage, water massage, etc"
Massage,"is pleasant, is relaxing, is welcomed, is expensive, is given on vacation, is given on special occassions, is relieving"
Massage,"soothing, relaxing, relaxes muscles, gets rid of pain and stress, difficult for person giving massage, uses muscles"
Massage,"relaxing, sometimes painful, expensive, different types"
Massage,"soft, loving, gently, feels great, massage by hands, expensive"
Massage,"helps a sore muscle, usually on your back, like to receive not give "
Massage,
Massage,
Massage,
Massage,"unattractive in appearance, smells bad, poorly groomed hair, unwashed clothes"
Past,"is before now, is childhood, is easy"
Past,"old, gone, memories, experience"
Past,"already happened, can't be changed, important to the future"
Past,"teaches you lessons, look back on, memories, how far i have come"
Past,"already happened, gone, done, over, you can't redo it"
Past,"what happened before present time, yesterday, ancestors"
Past,"has previously happened, memories, unable to change"
Past,"youth, experieces, yesterday, memories, pictures, can't get back, mistakes"
Past,"memory, history, cannot change"
Past,"over, went by, time, gone away, learn from your past"
Past,"old, already happens, history, back to the future"
Past,"anything before the present, history, "
Past,"history, ancestor"
Past,"1920's, memories, long time ago, history"
Past,"Things that have happened before the moment you are in. Some good, or bad memories. some historical. can make you stress, regret or you may erase them. you cannot change the past."
Past,"a time period that has elapsed, holds memories, reminscing, leads way for the future."
Past,"no longer, history, yesterday, last year, last month, ancestors"
Past,"The time that has already passed, nothing can be changed, makes us who we are and what we base future decisions on"
Past,"old times, high school, history"
Past,"present, already happened, already occurred, over, done with, long gone, future, sad times, happy times, stressful times, looking back on it, remembrance, pondering, "
Past,"once happened, always ""taking"" place"
Past,"something you cannot change, something that has already happend, an amount of time, "
Past,"before today, forgotten"
Past,"life, present, future, experience, loves"
Past,"Past is what has already happened. I wrote that sentence in the past. The past can never be undone, but becomes history as soon as it exists. A"
Past,"Memories, good and bad, can be blurry, can be easy to forget, held in your brain, uses your 5 senses to obtain or remember. photographs, familiar. Missed. "
Past,"gone, "
Past,"yesterday, everything that happened before today"
Past,"time which precedes the present, what has already happened, not the future or now, "
Past,"something that has happened, is done and over with, could be talking about someone who has died, could be talking about something you go by when you are walking or driving, could be meant with a deragatory undertone e.g. ""he has a past that i cant forgive"""
Past,"based on time, important to study, but should not be obsessed over, can be a strong source of pride or shame, considered much more primitive than now, less technology, "
Past,"behind, time, location"
Past,Events that have happened previously to the here and now. 
Past,"Everything that has happened, people dwell on it, some learn from it."
Past,"not the present or future, nothing can be done about it"
Past,"behind, old, "
Past,"already happened, something you look back on, good and bad, something that provides a need for a lot of conversation."
Past,"history class, missing something, memories, time"
Past,"is before the present, associated with ""before"", associated with ""history"", is not today, is not tomorrow, has to do with events before the present"
Past,"is history, can shape the future"
Past,"the opposite of the present, prior, a way to describe time, hard to remember everything from that time"
Past,is something that has already been done. is before the present and the future. 
Past,"what has happened before now, type of time, full of memories, saved by photos and other document"
Past,"passing of time, recent, old"
Past,"present, future"
Past,is irrelevant
Past,"what's already happened, unchangeable, memories, hindsight bias, history "
Past,"is unchangeable, previous actions you've made, life decisions you've made, affects your future overall, is behind you."
Past,"time, history, memories, youth"
Past,something that has already happened
Past,"is already done with, good, bad"
Past,"present, future, things that have happened before, you can learn from the past, gone by, not current"
Past,present
Past,"Opposite of future, secrets, backwards, time, it travels in one direction, history, science, interpretation "
Past,memories
Past,present
Past,"happened before, sometimes should be forgotten, memories, "
Past,"back then, in the olden days, what is done, already over, time period"
Past,not the present nor the future; 
Past,"a part of time, always behind you"
Past,"a long time ago, history"
Past,"think of personal past history, also general history of civilizations or regions, also as a time period compared with present and future"
Past,"cannot be changed, creates memories, creates wisdom, is responsible for present, is events in ones life that have already taken place"
Past,"already happened, in a person's memory, may be clear or faint, important to history"
Past,time that has gone by before the present time
Past,"gone, old, yesterday, time,  passed, missed"
Past,"regret, memories, pictures"
Past,
Past,
Past,
Past,"vertical rock, along rivers, made up of a dark rock, you can jumo from them, high in height, "
Pimple,"is gross, is annoying, is red, is puss filled, hurts, is ugly, is nasty, is embarrassing, is common"
Pimple,"zit, dirty, face, acne, dermatologist"
Pimple,"is a skin problem, has inflamation, can be popped, is irritating, red in color, has a white tip, occurs more in adolescents and teens"
Pimple,"red, gross, oozing, embarrasing, hormones, not attractive, oil, grease, dirt"
Pimple,"on your face, nasty, puss, acne, facewash, makes you feel dirty, they can hurt"
Pimple,"painful, contains white head, occur more with teens, unattractive, acne, can be a result from not washing properly"
Pimple,"is annoying, skin deformity, red, pus, clogged pore, bump"
Pimple,"yuck, zit, popping it, blood, make up, washing face, complection"
Pimple,"achne, gross, ugly"
Pimple,"nasty, teenagers, white head, black head, pop, filled with nasty stuff, found on skin"
