Pimple,"prom night ruiner, red, they hurt, are gross, shoot puss"
Pimple,"red, small, can be on a face, whitehead, blackhead, "
Pimple,"gross, red, can be popped"
Pimple,"gross, disgusting, red, small, on your face"
Pimple,usually associated with teenagers. Usually found on the face and back. they are red and big. they have green  or clear drainage. caused by STAF in the skin. commonly occur during stressful times. 
Pimple,"is a blemish on a face, is gross, distracting on a person's face, hard to get rid of, cause insecurities, a whitehead, is dirty, greasy, clears up within a week or so, Salicylic Acid helps make pimples go away, dermatologists prescribe medicines for pimples."
Pimple,"acne, blemish, redness, puss, pop, medicine"
Pimple,"Filled of puss on one's body, may be hurtful, sore and redness, using medicine and face washes eliminates them"
Pimple,"teenagers, puberty"
Pimple,"red, teenager, puberty, middle school, annoying, noticeable, aggravating, medicine, topical cream, pills, dermatologist visits, acne, boys and girls, face, back, arms, t-spot, "
Pimple,"unwanted, red, located on face, can be popped, teenager"
Pimple,"skin infection, white head, black head, treatable by a dermatologist, many medications for this, common problem among teenagers and young adults, on face, on back, on chest, cause for low self-esteem, caused by stress, caused by over-active oil glands"
Pimple,"gross, painful, looks bad, embarrassing"
Pimple,"pop, red, pain, puss"
Pimple,"A pimple is annoying. Little red bumps of acne that appear on your skin, especially when you are 12-17 years old. There are lots of ""cures"" for acne, but since many people still have it I'm doubtful they work. People can feel very insecure about their pimples."
Pimple,"it is red, it is painful, can lower self esteem, can be popped, also known as a zit or blemish, raises from skin, caused by clogged pores, embarrassing, common during puberty"
Pimple,"zit, adolescence, teenager, puberty"
Pimple,"blemish, often referred to as a zit, occurs frequently on adolescents going through puberty"
Pimple,"blemish caused by trapped dirt and oil under the skin, commonly facial but also found on the body, undesirable, unattractive, unpleasant, embarrassing, can be popped, fade eventually, can be medically treated"
Pimple,"zit, gross, painful, whitehead, blackhead, teenager, puss, acne, medecine, doctor, redness, swelling, sore, puberty, back, face, arms, chest, pituitary gland, salicylic acid, crushed asprin helps treat acne, many myths are used and abused on how to cure acne"
Pimple,"oil deposit, breaks open, can become infected, considered gross, a source of embarrassment, many people try to hide, genetic dispositions exist"
Pimple,"red, bump, pop,"
Pimple,An unwanted breakout on the human body that is filled with a pus like substance. Usually appears as a red or black circle. May itch or cause other discomfort.
Pimple,"is gross, dirt clogged in one's pore, infected, usually red, a bump, acne, caused by stress."
Pimple,"a blemish, caused by fatty foods or oily skin, can be caused by stress"
Pimple,"a face hazard, bad look, nasty, ugly, huge."
Pimple,"something that grows on teenagers, something that can make a person unattractive if they have to many, something annoying, something that goes away with face wash, is pink and gross."
Pimple,"youth, pro active, washing my face, gross, pain"
Pimple,"another word for ""zit"", is always a negative word, is red, is pink, is white, has a head, occurs on mostly teenagers, is small, is painful, needs to be popped, is not edible"
Pimple,"is a clogged pore, unattractive, people do many things to avoid them"
Pimple,"irritating, red, sometimes painful, gross, embarrassing, on your face, annoying "
Pimple,"is a bump on your face. is unwelcome. is red, bumpy, and gross. occurs usually in adolescents, teenagers, young adults. can be on your face and other places. "
Pimple,"dirty pores on peoples faces, white puss, people pop them, caused by stress, esteticaly un pleasing, looks gross, sometimes causes pain"
Pimple,"teenager, pain, bacteria, red, white, black, dermatologist, can be squeezed, puberty"
Pimple,"zit, nose"
Pimple,"is gross, represents oily skin"
Pimple,"painful, white head, popped, un-wanted by people (especially women), make-up is used to cover them, acne, dermatologists, creams"
Pimple,"is a result of bacteria build up in the skin, gross, white heads, can be taken care of with the use of creams or washes, often seen on teenagers, on any part of the body."
Pimple,"gross, teenagers, greasy, life ending, disgusting, horror, pro active, medicine, face wash"
Pimple,"zit, face, acne, pop"
Pimple,"gross, white head, acne, high school, youth, genetic, disgusting, annoying frustrating, embarrassing"
Pimple,"black heads, red, gross, white stuff inside, on your skin, can be swollen, embarressing, many people have them as they hit puberty, stress can cause them or your diet, lump, hurt"
Pimple,puss
Pimple,"Located on face or back, puss, is red, white spot, blemish, boil, dirt, hair follicle, clogged, gross, noticeable, puberty"
Pimple,acne
Pimple,puberty 
Pimple,"red, on face, full of pus, white head, pops, usually associated with ""nerd,"""
Pimple,"nasty, zit, embarrassing, dirty, red, white, needs to be popped, acne, gross"
Pimple,zit; usually appears in teenagers; big and red; draws attention to the face; can be reduced by washing your face; pops up when you are stressed out
Pimple,"acne, can occur on face, or anywhere on the body, look at poorly by society, happens to almost all teens"
Pimple,"gross, zit, white head, black heads, bump, creams"
Pimple,"zit, sore (like I have a pimple on my nose) that may be filled with disgusting pus."
Pimple,"is gross, is on faces, found on teenagers, meant to be popped, picked at, is white and red, is oily"
Pimple,"acne, appears on teenagers, annoying, dirty, puss-filled, red, pussy, white head, on face or back"
Pimple,"unattractive, stress, small, elevation of the skin"
Pimple,"acne, puberty, grease, oil, immature, gross, infection, puss"
Pimple,"disgusting, popping "
Pimple,
Pimple,
Pimple,
Pimple,belongs to you
Plastic,"is either hard or soft, used for cups, used for plates and utensils, used for tubs,"
Plastic,"recytreat container, fake"
Plastic,"comes in many colors, is normally smooth in texture, doesn't have much smell, makes up a lot of everyday things, can be recycled"
Plastic,"makes a lot of things, harmful to the envioronment, electronics, bottles, toys, car parts"
Plastic,"hard, handy, recyclable, one time use or multiple uses"
Plastic,"a hard material, has a smooth surface, used for many everyday objects, multicolored, flexible, not biodegradable, recyclable"
Plastic,"is hard, is cheap, is used in many manufactured goods, is fake, not a natural resource"
Plastic,"recycle, bottles, hard, soft, bendable, holds things, used everywhere "
Plastic,"dixie cup, "
Plastic,"bottles, sacks, recyclable, clear, thick or thin"
Plastic,"creditcard, recycle, boxes"
Plastic,"credit card, bag, made from petroleum, isn't biodegradable"
Plastic,"credit card, material, type of grocery bag, toys"
Plastic,"bags, Walmart bag, water bottle, credit card"
Plastic,"is recyclable, is clear, makes noise, wraps things up. comes in the form of bags, bottles. can be used to cover food, "
Plastic,"hard, made with petroleum, smooth, reusable, made in factories"
Plastic,"made of oil, used for packaging, used in bottles, recycleable, clear, used in medical field, sterile"
Plastic,"Resource highly used, should be recycled, petroleum by-product, many purposes, many forms"
Plastic,"bag, loud, recyclable, bottles, step on them, durable"
Plastic,"recycle, paper, green, environmental, earthly, bottles, containers, pencils, cups, bowls, plates, utensils, "
Plastic,"makes up many things we use, comes in many forms"
Plastic,"synthetic compound, recycleable, does not decompose naturally, stays in a landfill for millions of years, became popular in the 1950's, used for computers, used for car parts, used in clocks and microwaves, "
Plastic,"can recycle, used very often, can't put in microwave"
Plastic,"tube, tub, pipeing, bag, container"
Plastic,"Plastics are polymers that are easy to shape and make into various objects, used all the time in everyday life. Many believe plastics to be bad for the environment because of their long half-life. Plastic surgery is enhancement or reduction of physical features. "
Plastic,"saves lives, people litter with it too much, can be recycled, very convenient, used in most inventions. our society depends on it for a lot of things, useful. "
Plastic,"hard, soft, oil bi-product"
Plastic,"often used as a container, makes up many of our common household items, recyclable"
Plastic,"man-made, sometimes brittle, many colors, recyclable, useful, mass-produced, used in packaging, lightweight"
Plastic,"barbie, recycled, someone who has had plastic surgery, cheap, fake, bad when its burnt, employs millions of people, plastic the material"
Plastic,"extremely helpful, melts, contains bisphenol A,made with gasoline, non-decomposable, important discovery, "
Plastic,"storeage, oil, landfill, portable"
Plastic,"is a man-made material that is used with everyday objects. Not all forms of plastic are bio-degradable, although many are. "
Plastic,"Is a substance molded into different forms for different uses, used for toys, kitchen tools, debit cards, ect."
Plastic,"in toys, recyclable"
Plastic,"a material, used to make cups, used to make toys, clear, could be in different colors."
Plastic,"something that is used to contain items, bad for the enviornment, found at a grocery store, is white, makes a crumpling sound."
Plastic,"used in dishes, should be recycled, harmful BPA chemicals, barbie dolls"
Plastic,"is hard, is smooth, comes in many colors, is not edible, is used to make bottles, comes in many sizes, can be recycled, found mostly every where, used for making objects such as bottles or storage bins, used in a lot of various objects"
Plastic,"is used in almost everything, is used to create things, is used to hold, to protect, to defend"
Plastic,"is on many things, very important to society, hard or may be flexible, can be any color, plastic salesman and company, alot of money to be made manufacturing and selling it"
Plastic,"Can be bottles, wrappers, containers, bowls, plates, cups, knives, forks, spoons. "
Plastic,"flexable, protects, water proof, used for alot of things in all different types of industries,"
Plastic,"hard, thin, thick, all types of volumes and densities, isnt edible, "
Plastic,"fake, clear"
Plastic,"is hydrocarbons, is versatile"
Plastic,"bottles, non-recyclable, harmful when burned, what A LOT of things are now made of, plates, melts"
Plastic,"is a substance, recyclable, used to make a variety of things such as bottles."
Plastic,"used to contain items, creates pollution, hurts animals, not edible, melts, clear"
Plastic,"used for tubberwear, melts eaily, do not put in a microwave"
Plastic,"is hard, container, man made"
Plastic,"can be plastic ware like spoons and forks, can describe someone thats fake, a barbie, hard, solid, plastic wrap, many things are made of plastic"
Plastic,cups
Plastic,"Bottles, pollutes the earth, never disintegrates, plastic bowls, convenient, cheap, smooth"
Plastic,synthetic
Plastic,wrap
Plastic,"tough, bottles, toys, recycable, "
Plastic,"recyclable, usually clear, can be colored, used for water bottles, used to wrap toys in stores"
Plastic,durable; water bottle; containers; 
Plastic,"very useful resource, but not good for the environment if burned or not recycled"
Plastic,"bottles, recycle, bags,binders, cups, plates, forks, spoons, damaging."
Plastic,describes a synthetic manufactured material (not naturally occurring) can be hard or pliable
Plastic,"is synthetic, is everywhere, is clear, is colorful, is created by science, is useful, is new in the world, is a part of many products, is manufactered"
Plastic,"bendable, solid, clear or colored, not edible, melts, holds items together, used for storage, used for liquids"
Plastic,"a material that can be shaped into any size or shape when soft, a slang term for money, using a credit or debit card in place of paper money"
Plastic,"hard, non-flexible, throw-away, landfill"
Plastic,"bottles, pens, storage units"
Plastic,
Plastic,
Plastic,
Plastic,almost the same
Rough,"can hurt, can be emotional or physical, is bumpy, is sand paper, creates friction"
Rough,"scratchy, worn, jagged, rocky"
Rough,"not smooth, difficult, "
Rough,"challenging, overcoming defeat, sports games, sex, emotional, tiring"
Rough,"hard, sand paper, not comfortable, itchy"
Rough,"opposite of soft, bumpy, unpleasing feeling, also used as an adjective to an action that took place (i had a rough time finishing the survey), sandpaper, bark on a tree"
Rough,"is a bumpy texture, adjective used to describe the lack of smoothness of an even of object "
Rough,"rigid, scratchy, sidewalk, hard, intense, hurt, "
Rough,"not smooth, gravel, manly, bumpy"
Rough,"not smooth, hard, friction, uneven"
Rough,"sandpaper, octagons, bikers"
Rough,"sandpaper, rocks, "
Rough,"sandpaper, rocks"
Rough,"sandpaper, bad situation, awful touch, rocks"
Rough,"can be hard, aggressive, inconsiderate, harsh, "
Rough,"bumpy, has ridges, also could mean a bad time, not smooth, hard."
Rough,"uneven, not smooth, rough people, rough surfaces, rough experience"
Rough,"Scratchy, resistance, friction, hard, describes harsh terrain"
Rough,"tackling, sandpaper, rocks"
Rough,"hard, bumpy, brown, black, concrete, turf, coarse, nail filer, complicated, sand paper, alligator, black top, bottoms of pools, "
Rough,"hard, rigged, tough"
Rough,"sandpaper, cat's tounge, can be unpleasant to the touch, wood, concret, rocks"
Rough,"waves, water, animals skin"
Rough,"day, time, surface, life, career, ground"
Rough,"Rough is the opposite of smooth or soft. It can mean bumpy or abrasive, like sandpaper. People can have rough personalities, and certain tasks can be considered ""rough"" or hard to accomplish."
Rough,"rigid, bumpy, the opposite of smooth, beards, concrete, edges, hard"
Rough,"rough housing, hard"
Rough,"Opposite of smooth, textured"
Rough,"scratchy, opposite of soft and smooth, synonymous with rugged, describes something being difficult or tough as well as jagged and un-smooth"
Rough,"tough, rigid, hard to understand, sandpaper, something that is bumby or unsmooth, when a body of water is choppy, when someone has a 5 oclock shadow, could be used as an adjective ""you look rough"" or ""you had a rough night"""
Rough,not a noun?
Rough,"hard, difficult, sandpaper, texture"
Rough,"Not soft, too hard, forceful, hurtful, unpleasant."
Rough,"is not soft, difficult, challenge."
Rough,"not smooth, rigid"
Rough,"hard, mean, "
Rough,"something that bothers you, someone who plays around too much, fighting, found between brothers and sisters."
Rough,"boys, pain, wrestling, bumpy"
Rough,"is associated with ""bumpy"", could be a texture word, could also be associated with the word ""bad"", used to describe a feeling or situation, could be used to describe the texture of an object"
Rough,"not smooth, can be used to describe more negative members of society, can be used to describe dangerous areas"
Rough,"scruffy face, uncomfortable, sandstone, concrete, bad feeling"
Rough,"is a feeling. some work is rough, some material is rough. "
Rough,"opposite of smooth, describes personality, feeling of jagged, used for guessing close to something"
Rough,"hurts, cement, wood, friction, falling, touching"
Rough,"skin, situation"
Rough,is abrasive
Rough,"Mean, unpleasant, roads come to mind, difficult situation"
Rough,"hard to the touch, hard to do, had a bad night, looks wise."
Rough,"hard, not satisfactory, hurts, abrasive, not smooth, texture"
Rough,"not smooth, surface"
Rough,"hard, rugged, sharp, abusive, hardcore"
Rough,"not smooth, ridges, not pleasent, difficult, harsh, rough around the edges, something that is difficult, bad"
Rough,sand paper
Rough,a rough? not a noun
Rough,coarse
Rough,boy
Rough,"hard, shell of a turtle, "
Rough,"hard, not soft, uncomfortable, bad texture, not smooth, rocky, rough housing, wrestling"
Rough,not soft; 
Rough,"not smooth, scruffy, could be a man's beard or something from nature like tree bark"
Rough,"rough skin, rought objects, texture, uneccessary, uncalled for, hurt"
Rough,coarse - can be used to describe physical characteristics like surface; also used to describe personality (adjective)
Rough,"hurts hands, creates wounds, is bumpy, used to cut, used to smooth, can be found outdoors"
Rough,"not smooth, doesn't feel good to touch, sharp, pointy, can be touched, rigid, scratchy"
Rough,"sand paper, coarse surface, acting with violence"
Rough,"not smooth, tough, feel, touch, not liked"
Rough,"hard, doesn't feel good on feet"
Rough,
Rough,
Rough,
Rough,"it's a color, primary color, has many colors that branch off of it i.e navy blue, it's associated with the color of the sky "
Rules,"are limits, regulations, have consequences, are everywhere, are governed, are sometimes stupid"
Rules,"guidelines, expectations, laws, contents to follow"
Rules,"are guidelines, often encourage people to break them, provide organization"
Rules,"guidelines, suggestions of what you should do, tempting to break, laws "
Rules,"regulations, guidelines, things to follow, will keep you safe, needed in society"
Rules,"guide lines, expectations, laws/policies that must be followed"
Rules,"important to society, discipline, structure"
Rules,"morals, too many rules, laws, controling, keep you safe, "
Rules,"guidlines, limmits"
Rules,"meant to be followed, punishment if disobeyed, enforced by authorities, spell out what not to do, principles, codes, law, guideline, keeps order"
Rules,"rules are for squares, obey, teachers, police"
Rules,"restriction, something to follow, a penalty for breaking it, laws"
Rules,"restrictions, limits"
Rules,"school, parents, prison, discipline"
Rules,"they are everywhere. referred to as laws. rules in school, no talking, no running, no getting out of your seat, raise your hand, ask for permission, no cell phones, no chewing gum. Rules limit what you are aloud to do in a certain environment. "
Rules,"are made by a higher authority, can be obeyed or broken, usually made to protect the well-being of a group of people, safety issues, address respect, used to maintain order."
Rules,"school, playground, things to follow, ensure safety, boring, lists of rules, laws"
Rules,"Restrictions, everyone has some type, ruled by upper authorities, receive consequences if broken, receive rewards if kept"
Rules,"school, parents, military, jail"
Rules,"parents, before college, want independence, for your own sake, watching out for you, laws, national, state, public, local, county, Country, boring, annoying, older people assign them, authority figures assign them, lots of them are usually a hassel"
Rules,"meant to be followed, always broken, also means ""is awesome"", are in everything you do"
Rules,"regulations you must follow for saftey of yourself and others, can be strict, can be lax, can be made up by figures of authority like parents, teachers, put on posters and signs, give people directions, prevent harm, prevent emotional distress, prevent cheating and unfair awards"
Rules,"a list of things to follow, everyone has them at some point"
Rules,"breaking, guide, law"
Rules,"Rules are guidelines and precepts laid down by authorities to control and influence people's decision making and to protect others. Police are the rule enforcers of society, but so are teachers, parents, coaches, and other authorities. Rules can be used to control populations."
Rules,"maintain a decent society, we live by them, if you don't follow them you can be punished, the country uses them, our mothers and fathers use them, we are taught to obey them, people make them up, they usually enforce morals. "
Rules,"regulations, terms"
Rules,"something you must follow, instructions"
Rules,"important to obey, guidelines to be followed, meant to be broken, put in place to inform, control, suggest, or protect"
Rules,"something you must abide by, something put into effect to make the action of something else run smoother, if not abided by punishment is expected, not meant to be broken, can be used in the sense of ""mathmatical rules"" or ""scientific rules"" or ""life rules"""
Rules,"Unnecessary, often oppressive, hinder societal change, generally created for the benefit of a few, generally created because of the failings of a few, often subjective, only important when they are enforced, effective behavior modification tools, powerful persuasive advantages"
Rules,"society, follow, directions"
Rules,"A set of guidelines that are meant to be followed. May or may not involve punishments. These guidelines may be inforced by parents, or by a larger power such as the federal government of the United States of America."
Rules,"boundaries drawn up to keep chaos down, used in schools, sports, ect."
Rules,keep order
Rules,"law, safety tips,helpful, organize, order, "
Rules,"sets limits on what you can and can't do, tells you how to live, makes you not free, meant to keep you safe and everything fair."
Rules,"no fun, school, law enforcement, getting in trouble, long lists"
Rules,"is a set of guidelines needed to maintain control and peace within a group or organization, usually a negative word, can get someone in trouble with the law or with a leader"
Rules,"help to ensure democracy, keep order, used in games, used in governments"
Rules,"must follow them, on signs, part of everyday life"
Rules,are important. keep control and calm. keep things in order.
Rules,"guide lines, used to keep order, regulations, made by a higher order, used in society"
Rules,"leadership, caution, care"
Rules,"laws, policies"
Rules,"are made to be broken, are necessary"
Rules,"not meant to be broken, punishment if they are broken, school, law enforcement, general societal rules"
Rules,"are there to keep things in orderly fashion, are sometimes harsh or strict, have a divine purpose, are punishable if broken."
Rules,"created by leaders, sets boundaries, not liked, needed, good and bad, everywhere, lists "
Rules,"laws, not to be broken"
Rules,"are laws, written, followed, discipline, setbacks, way of life"
Rules,"To abide by, a list of things to follow, people like to break rules, help keep our country together so things dont get out of hand, ground rules"
Rules,strict
Rules,"They keep stability, they are involved in everything such as in a classroom or at a job, lists"
Rules,authority
Rules,Elementary school
Rules,"shouldnt be broken, used to create order, sometimes unneccessary if there are too many, "
Rules,"guidelines, useful, annoying, laws, dress code, curfews, restrictions, help keep people in line, hold people back, needed to keep the world from going insane"
Rules,standards that have to be followed; classroom rules; laws made by the government
Rules,"guildlines, laws, not always followed"
Rules,"regulations ,broken rules, follow rules, obey, disobey, sometimes stupid and uneccessary"
Rules,guidelines and boundaries
Rules,"are meant to be followed, are given to maintain order, and written on paper, are known by many, are accepted, are disobeyed"
Rules,"give structure, laws of a classroom or event, need to be written and known by people, hang on wall, need to be followed, there are consequences for broken rules"
Rules,"a regulation of governing conduct, code of regulations to follow for a group of people"
Rules,"follow, harsh, punishment if broken, boring, safety, broken sometimes"
Rules,"obey, mandatory, laws"
Rules,
Rules,
Rules,
Rules,"disease, infected cells, genetic or environmental, have symptoms, many different types"
Salad,"has lettuce, and tomatoes, has dressing, is green, is crunchy, is cold, is delicious, is healthy "
Salad,"dressing, lettuce, healthy, vegetables"
Salad,"is made of lettuce and other vegetables, is healthy to eat, is green and other colors, can be unique to the creator"
Salad,"green, leafy, ranch, honey mustard, oil and vinegar, tasty, healthy"
Salad,"green leaves, vegetables, cheese, choosing what you want, spinich, croutons, crunchy"
Salad,"appetizer, made of mostly lettuce, accompanied with dressing, can contain vegetables/cheese/croutons, expands the stomach"
Salad,"is a food, is typically a healthy food, is a mixture of different things, can be fruit, vegetable, potato, or pasta mixture, commonly available"
Salad,"lettuce, dressing, cheese, vegetables, nuts, yummy, fruits, healthy, diet"
Salad,"healthy, tasty, leafey, ranch, cheese, yummy"
Salad,"lettuce, tomatoes, vegetables, dressing, fruit, mixture, healthy, salad bar"
Salad,"ceaser, house, leaves, starter, crouton, has dressing"
Salad,"Food, green, leafy, taco salad, croutons, cheese, cold, ranch dressing, "
Salad,"food, green, leafy, pasta salad, taco salad has croutons, has tomatoes"
Salad,"crutons, ranch dressing, cheese, tomatoes, ceasar salad, chicken salad, tuna salad, fruit salad"
Salad,"food. is green. consists of vegetables like; carrots, onions, lettuce, tomatoes, celery, cucumbers. topped with dressing. comes in a liquid form of ranch, italian and many more flavors. topped with croutons, and cheese. is healthy. some eat with crackers or pizza. served in restaurants and at home. is also called rabbit food. "
Salad,"is a mixed of lettuce, vegetables, dressing, green, nutrients, tastes fresh."
Salad,"salad dressing, vegetables, lettuce, green, cucumber, tomatoes, carrots, peppers, broccoli, fork"
Salad,"Mix of foods eaten, usually with leafy vegetable and dressing, also could be chicken or pasta, "
Salad,"green, healthy, crunchy, leaves, spinach, carrots"
